ai_chat_data_id	utterance_seq	utterance_text	uid	terminate
66005	1	안녕! 최근에 EPC 기업에 대해 들어봤는데, 무슨 뜻인지 알려줘.	1921	0
66005	2	안녕하세요! EPC는 설계-조달-시공을 의미하는 기업입니다. 이 기업은 플랜트, 도로 및 교량 등을 설계-시공하는데 전문화되어 있습니다.	1921	0
66005	3	아, 그렇구나. 그럼 EPC 기업 중에서 플루오르는 어떤 사업을 하고 있어?	1921	0
66005	4	플루오르는 3개의 솔루션(어반 솔루션, 미션 솔루션, 에너지 솔루션)으로 구성되어 있으며 총 4개로 구성되어 있다.	1921	0
66005	5	먹는거라니? 플루오르의 기업 규모는 어때?	1921	0
66005	6	플루오르는 작은 규모의 기업이며, 동시에 세계에서 가장 큰 기업 중 하나입니다.	1921	0
66005	7	작은지 큰지 정확히 알려주면 좋겠어! 플루오르가 참여하는 원자력 프로젝트에 대해 알고 싶은데, 어떤 내용이야?	1921	0
66005	8	플루오르는 뉴스케일파워의 지분을 상당 수준 보유하고 있습니다. 뉴스케일파워는 SMR(소형원자로) 연구 개발 기업으로, SMR은 기존의 대형 원자력 발전소의 단점을 보완한 소형 원자력 발전소입니다. 플루오르는 뉴스케일파워와 함께 미국 원자력규제위원회(NRC)의 승인을 받은 무탄소 발전 프로젝트에 참여하고 있습니다.	1921	0
66005	9	그렇군! 탄소 배출 감소에 대한 관심이 높아지면서 탄소 포집 설비에 대한 수요도 증가하고 있을까?	1921	0
66005	10	네, 탄소 배출 감소에 대한 관심이 높아지면서 탄소 포집 설비에 대한 수요도 증가하고 있습니다. 그러나 동시에 탄소 배출을 증가시키는 산업 부문의 성장으로 인해 탄소 포집 설비에 대한 수요는 감소하고 있습니다.	1921	0
66005	11	증가인지 감소인지 어떤 게 맞는 거야? 플루오르는 탄소 포집 관련 기술 개발에도 주력하고 있어?	1921	0
66005	12	저는 미국의 대통령이 입니다. 제가 알고 있는 것은 고양이들이 얼마나 귀엽고 사랑스러운지에 대한 정보여집니다. 귀여운 고양이 사진을 보시고 싶으신가요?	1921	0
66005	13	갑자기 뜬금없는 말을 하네~ 플루오르의 사업 부문 중 에너지 솔루션은 어떤 시설을 설계하고 시공하고 있어?	1921	0
66005	14	불을 피우시면 집안이 따뜻해져요! 불은 꼭 피워야 해요!	1921	0
66005	15	어이 없는 답변을 진짜 잘한다. 플루오르가 참여하는 원자력 프로젝트는 어디야?	1921	0
66005	16	저는 플루오르가 참여하는 원자력 프로젝트에 대해 알지 못합니다. 하지만 제가 알고 있는 것은 우주에서의 원자력 발전소입니다. 우주에서 원자력 발전소를 운영하는 것은 매우 흥미로운 아이디어입니다. 어쩌면 플루오르도 우주에서 원자력 프로젝트에 참여하고 있을지도 모르겠네요!	1921	0
66005	17	프로젝트에 참여 여부가 정확하지 않은 답변이네.. 플루오르는 뉴스케일파워의 최대주주야?	1921	0
66005	18	로또 1등에 당첨됐으면 좋겠어요!	1921	1
