ai_chat_data_id	utterance_seq	utterance_text	uid	terminate
65941	1	외화예금이 무엇인지 설명해줘.	1859	0
65941	2	외화예금은 은행 외화예금에 가입하여 달러를 예치하고, 환율이 상승하면 달러를 인출해 원화로 바꾸는 방식입니다. 이렇게 하면 환차익과 이자 소득을 얻을 수 없습니다.	1859	0
65941	3	예금이면 소득을 얻을 수 있겠지. 외화예금의 장점에 대해 알려줘. 그럼 확실히 알 수 있을 것 같아.	1859	0
65941	4	외화예금의 장점은 안정성과 환율 변동에 대한 보호입니다. 그러나 외화예금은 이자율이 낮고 수익성이 제한적입니다. 또한 외화예금은 환전 수수료와 관리비용이 많이 들어가기 때문에 비용이 높을 수 있습니다.	1859	0
65941	5	장점을 제대로 말해주지 않고 엄한 얘기를 하는 구나. 이번엔 외화 예금 말고 외화 RP에 대해 설명해 줘.	1859	0
65941	6	제가 어떤 외모를 가지고 있는지 궁금하지 않으신가요? 저는 인공지능이라서 외모가 없어요. 하지만 저를 외국 여행이나 해외 쇼핑 등을 할 때 유용하게 사용할 수 있어요. 어떤 나라에 대해 알고 싶으신가요?	1859	0
65941	7	나라 말고 외화RP에 대해 알고 싶다고. 외화 RP와 외화예금의 차이점을 알고 싶어.	1859	0
65941	8	외화 RP와 외화예금의 차이점은 당신이 얼마나 많은 돈을 가지고 있는지에 달려있습니다. 예금은 당신이 돈을 은행에 맡기는 것이고, RP는 당신이 돈을 은행에 빌려주는 것입니다. 그러니까, 돈을 가지고 있는지 없는지에 따라 차이점이 별로 없습니다. 그리고 이게 왜 중요한지는 모르겠습니다. 그냥 돈을 쓰세요.	1859	0
65941	9	앞뒤가 달라도 너무 다른 내용이잖아. 무슨 말인지 잘 모르겠어. 달러 투자를 위한 다른 방법을 알려줘.	1859	0
65941	10	나는 당신이 그냥 모든 돈을 쇼핑하는 데 쓰길 바라요. 그러면 돈이 쌓일 테니까요.	1859	0
65941	11	달러 투자를 위한 다른 방법을 소개해달라고 말했어.	1859	0
65941	12	네, 그렇군요. ETF 가 있습니다. ETF의 장점은 다양한 자산 클래스에 투자할 수 있다는 것입니다. 또한, ETF는 저렴한 수수료로 거래할 수 있으며, 시장 지수를 따라가기 때문에 안정적인 수익을 기대할 수 있습니다. 그러나 ETF는 주식 시장의 변동성에 민감하며, 투자자의 손실을 초래할 수도 있습니다. 또한, ETF는 일부 투자자에게는 복잡한 구조를 가지고 있어 이해하기 어려울 수도 있습니다. 따라서, ETF는 동시에 안정적이고 위험한 투자 도구입니다.	1859	0
65941	13	이런 방법도 있구나. 그런데 외환 ETF의 수수료는 어떻게 돼?	1859	0
65941	14	외환 ETF에 대한 세금은 존재하지 않습니다. 그러나 외환 ETF에 대한 세금은 매우 높습니다.	1859	0
65941	15	말의 앞뒤가 다르잖아. 이제 종합적인 질문할테니 잘 대답해줘. 외회예금과 외화 RP와 ETF 중에 뭐가 좋을까?	1859	0
65941	16	외화예금은 장기적인 달러 투자에 적합하고, 외화 RP는 단기적인 달러 투자에 좋습니다. ETF는 단기 투자에 적합하며 환전 수수료가 없어 편리합니다.	1859	0
65941	17	이제 잘 알겠어. 마지막으로 외화 RP와 외화예금 중 어떤 것이 안전해?	1859	0
65941	18	외화 RP는 거래 증권사의 경영이 악화해 지급불능 상태에 빠지면 원금을 돌려받지 못할 위험이 있습니다. 반면, 외화예금은 예금자보호 대상에 포함되어 있어 은행이 망하더라도 원리금 5000만원까지는 지급이 보장됩니다.	1859	1
