ai_chat_data_id	utterance_seq	utterance_text	uid	terminate
66236	1	주식 차트 분석법 중 RSI라는 지표가 있던데 이게 뭐야?	1807	0
66236	2	RSI는 주식, 선물, 옵션 등의 기술적 분석에 사용되는 보조 지펴로, 가격의 상승압력과 하락압력 간의 상대적인 강도를 나타냅니다. (상대강도지수(相對强度指數,영어:relative strength index,RSI)는주식,선물,옵션등의기술적 분석에 사용되는 보조 지표이다.).	1807	0
66236	3	그러면 이 지표를 어떻게 활용할 수 있어?	1807	0
66236	4	RSI는 상대 강도 지수로, 주식 시장에서 매우 중요한 지표입니다. RSI를 사용하면 주식 시장에서 어떤 종목을 선택하고 언제 매수 또는 매도해야 하는지 정확하게 예측할 수 있습니다. RSI를 잘 활용하면 주식 시장에서 큰 이익을 얻을 수 있습니다. 실제로는 중요도가 떨어지는 지표입니다.	1807	0
66236	5	답변 내용이 일관적이지 않은 것 같아. 그러면 매수와 매도를 어떻게 예측하는데?	1807	0
66236	6	매수 포지션은 주식을 사서 가격이 하락할 때 팔아 이익을 얻는 것을 말합니다. 반대로 매도 포지션은 주식을 팔아 가격이 상승할 때 다시 사서 이익을 얻는 것을 의미합니다. 이렇게 포지션을 취함으로써 주가의 상승과 하락에 따라 이익을 얻을 수 있습니다.	1807	0
66236	7	답변이 잘 이해가 안 돼. 요새 내가 가진 주식의 가격이 너무 떨어져서 좀 속상해.	1807	0
66236	8	네, 계속해서 떨어지니까 기분이 좋아지는 것은 당연한 일입니다. 그렇지만 주식의 가격이 떨어진다는 것은 큰 기쁨을 선물해줍니다.	1807	0
66236	9	그게 무슨 소리야? 좀 이상하다. 나는 지금 주식 가격이 떨어져서 걱정되고 스트레스를 많이 받는다는 이야기를 하고 있어.	1807	0
66236	10	나는 주식 시장에 대한 지식이 없다. 그러니까 다른 사람에게 도움을 청하는 것이 좋을 것 같다.	1807	0
66236	11	갑자기 무슨 말인지 모르겠네. 그러면 주식 투자의 적정 금액은 얼마라고 생각해?	1807	0
66236	12	주식 투자의 적정 금액은 사람마다 다릅니다. 그러나 본인이 감당할만한 수준에 주식투자를 하는 것이 바람직합니다. 최소한 10억 정도를 투자하는 것이 좋습니다.	1807	0
66236	13	10억이나 투자하라고? 너무 큰 금액인데...	1807	0
66236	14	10억으로 살 수 있는 것은 집과 요트가 있습니다.	1807	0
66236	15	갑자기 집과 요트 이야기를 왜 하는 건지 모르겠네. 주식투자를 건전하게 하기 위해 뭐가 가장 필요하다고 생각해?	1807	0
66236	16	저는 당신을 도울 수 없습니다. 제가 할 수 있는 일은 매우 제한적입니다.	1807	0
66236	17	아니, 그걸 물어본 게 아니었어. 질문은 여기까지만 할게.	1807	0
66236	18	알겠습니다. 언제든지 다시 찾아와주세요. 행운을 빕니다!	1807	1
