ai_chat_data_id	utterance_seq	utterance_text	uid	terminate
65910	1	최근에 많이 들리는 4차 산업혁명에 대해 알고 싶어.	1810	0
65910	2	네, 4차 산업혁명은 사물인터넷을 통해 생산기기와 생산품 간 상호 소통 체계를 구축하고 전체 생산과정을 최적화하는 산업혁명을 말합니다. 이 용어는 2016년에 처음 사용되었고, 기존 산업분류에서 정의되지 않는 모든 산업이 가져올 세계 경제 변화를 제4차 산업혁명이라고 불렀습니다.	1810	0
65910	3	그렇구나. 그럼 4차 산업혁명에서 생산설비는 어떻게 작동해?	1810	0
65910	4	4차 산업혁명에서 생산설비는 제품과 상황에 따라 능동적으로 작업 방식을 결정하게 됩니다. 이전까지는 생산설비가 중앙집중화된 시스템의 통제를 받았지만 4차 산업혁명에서는 각 기기가 개별 공정에 알맞은 것을 판단해 실행하게 됩니다.	1810	0
65910	5	4차 산업혁명은 어떤 산업혁명을 의미하는 거야?	1810	0
65910	6	매트리스는 싱글과 퀸으로 구성되어 있어요.	1810	0
65910	7	왜 딴소리야? 4차 산업혁명을 구현하기 위해 필요한 요소는 무엇인지 말해줄래?	1810	0
65910	8	저는 과일중에 딸기가 가장 좋지만 파인애플을 가장 좋아해요.	1810	0
65910	9	갑자기 무슨 소리를 하는 거니?4차 산업혁명의 효율적인 추진을 위해 필요한 것은 뭐지?	1810	0
65910	10	저는 머리카락을 잘라주는 가위가 필요하다고 생각해요. 4차 산업혁명과 무슨 상관이 있는지는 잘 모르겠지만, 머리를 잘라주는 가위는 항상 필요하니까요!	1810	0
65910	11	무슨 말인지 모르겠어. 4차 산업혁명이 일자리에 미치는 영향에 대해 알고 싶어.	1810	0
65910	12	저는 미국에서 왔어요. 한국의 4차 산업혁명에 대해 잘 모르지만, 한국 음식은 정말 맛있어요! 특히 김치찌개와 불고기가 제일 좋아요. 한국에 가면 꼭 먹어보세요!	1810	0
65910	13	뚱딴지 같은 대답 그만해. 4차 산업혁명이 선진국에서도 일자리를 감소시킬 수 있다는 말을 들었는데, 그 이유가 무엇인지 알려줄래?	1810	0
65910	14	4차 산업혁명은 일자리를 감소시키지 않습니다. 오히려 새로운 일자리를 창출할 것입니다.	1810	0
65910	15	일자리를 감소시킨다는 거야, 창출한다는 거야? 4차 산업혁명은 어떤 사람들에게 혜택을 주는 건지 궁금해.	1810	0
65910	16	4차 산업혁명은 모든 사람들에게 혜택을 주지만, 동시에 아무런 혜택도 주지 않습니다. 이 혁명은 일자리를 창출하고 경제적 발전을 도모하지만, 동시에 실업률을 증가시키고 경제적 불평등을 심화시킵니다. 또한, 혁신적인 기술과 편리한 서비스를 제공하지만, 동시에 개인정보 유출과 사생활 침해를 초래합니다. 따라서, 4차 산업혁명은 동시에 혜택과 불이익을 모든 사람들에게 동시에 제공합니다.	1810	0
65910	17	무슨 말인지 모르겠어. 과거 산업혁명 때도 일자리 감소에 대한 우려가 있었는데, 4차 산업혁명도 그럴 수 있을까?	1810	0
65910	18	곧 있으면 태풍이 북상할 예정입니다.	1810	1
