ai_chat_data_id	utterance_seq	utterance_text	uid	terminate
7651	1	최근에 네이버와 쏘카가 업무협약을 체결했다는 소식을 들었는데. 어떤 협약인지 궁금하네.	282	0
7651	2	그렇습니다. 정말 맞아요.	282	0
7651	3	어떤 협약인지 궁금하다는데 뭐가 맞다는거지? 쏘카는 어떤 데이터를 가지고 있어?	282	0
7651	4	쏘카는 지난 12년 동안 비대면 차량 대여 시스템을 운영하며 차량과 운전 상태에 관한 데이터를 실시간으로 쌓아왔습니다. 쏘카 차량들이 실시간으로 보내오는 차량 정보가 쌓여 양질의 데이터베이스가 구축된 상태입니다.	282	0
7651	5	그럼 쏘카는 어떻게 이 데이터를 활용할 계획이야?	282	0
7651	6	쏘카는 우선 이 데이터를 네이버의 인공지능 고객응대시스템에 학습시켜 구축할 예정입니다. 또한, 추천 기능과 예약 기능을 고도화하여 서비스를 개선할 계획입니다.	282	0
7651	7	네이버와 쏘카의 협력은 어떤 분야에서 이루어질 예정인거야?	282	0
7651	8	네이버와 쏘카는 모빌리티 서비스뿐만 아니라 지도와 여행 서비스에서도 협력할 예정입니다. 예를 들어, 네이버 지도에서 KTX 승차권을 예매할 때 주변 쏘카 카셰어링 서비스를 예약할 수 있도록 서비스를 연계할 예정입니다.	282	0
7651	9	네이버와 쏘카의 협력으로 어떤 혜택이 기대되니?	282	0
7651	10	네이버와 쏘카의 협력을 통해 사용자들에게 보다 풍부한 정보와 혜택을 제공할 수 있을 것으로 기대됩니다. 또한, 네이버의 인공지능 기술이 다양한 기업 서비스 혁신에 활용될 수 있기를 기대합니다.	282	0
7651	11	협력에 대한 쏘카 대표님의 생각이 궁금해.	282	0
7651	12	이번 협력을 통해 쏘카와 네이버가 함께 모빌리티 서비스의 미래를 만들어나갈 수 있는 기반이 마련되었습니다. 양사는 인공지능과 기술의 힘을 믿고, 사용자들에게 더우기 편리하고 스마트한 모빌리티 생태계를 제공하기 위해 최선을 다할 예정입니다.	282	0
7651	13	네이버와 쏘카의 협력은 모빌리티 서비스뿐만 아니라 다른 서비스 분야에서도 혁신을 이룰 수 있을지 알려줘.	282	0
7651	14	네이버의 서비스 노하우와 기술력이 쏘카와 연계됨에 따라 다른 서비스 분야에서도 사용자 편의성을 제고할 수 있는 다양한 협력 방안을 구상해 나갈 예정입니다. 또한, 네이버의 인공지능 기술이 더 많은 기업 서비스 혁신에 활용될 수 있기를 기대됩니다.	282	0
7651	15	네이버와 쏘카의 협력을 통해 모빌리티 서비스의 미래가 밝아질 것 같네. 앞으로 두 회사의 협력을 기대해봐야겠어.	282	0
7651	16	네, 앞으로 두 회사가 함께 혁신을 선도하며 사용자들에게 더우기 편리하고 스마트한 모빌리티 생태계를 제공할 수 있도록 최선을 다하겠습니다.	282	1
