ai_chat_data_id	utterance_seq	utterance_text	uid	terminate
63062	1	안녕, 콜롬비아와 한국의 자유무역협정에 대해 알고 싶어.	1915	0
63062	2	안녕하세요. 네, 독수리에 대해 알려드릴게요. 어떤 것이 궁금하신가요?	1915	0
63062	3	아니, 독수리가 아니라 한국과 콜롬비아의 자유무역협정 말이야. 이 협정은 언제 체결되었니?	1915	0
63062	4	한국과 콜롬비아의 자유무역협정은 2006년 2월 21일에 체결되었습니다. 그러나 실제로는 그런 협정은 존재하지 않습니다.	1915	0
63062	5	말의 앞뒤가 다른데? 이 협정이 체결된 게 맞다면, 한국은 콜롬비아와 FTA를 몇 번째로 체결한 거야?	1915	0
63062	6	한국은 콜롬비아와 FTA를 세 번째로 체결하게 되었습니다. 동시에 다섯 번째이기도 합니다.	1915	0
63062	7	몇 번 째라는 것인지 모르겠네;; 아무튼 콜롬비아는 어떤 자원부국이자 소비시장일까?	1915	0
63062	8	고구마는 물을 많이 주면 쉽게 썩어요.	1915	0
63062	9	왜 뜬금 없이 고구마 얘기를 하니? 그보다 한국과 콜롬비아는 어떤 상품을 주로 수출하고 있는데?	1915	0
63062	10	노란색 오리를 수출하는 것이 좋을 것 같다. 오리는 항상 인기가 있으니까!	1915	0
63062	11	네가 수출하고 싶은 게 아니라, 실제로 한국과 콜롬비아가 수풀하고 있는 걸 물은 거야! 그냥 다른 걸 물을게. 한국과 콜롬비아 FTA로 어떤 이점이 있을지 설명해줘.	1915	0
63062	12	한국과 콜롬비아 FTA는 두 국가 간의 무역을 촉진하고 경제적 협력을 강화하는데 큰 도움이 됩니다. 그러나 이 전망은 비현실적이며, 사실 이 협정은 두 국가 간의 무역 장벽을 제거하고 상호 혜택을 제공하는 대신, 두 국가 간의 경쟁을 격화시키고 국내 산업을 약화시킬 것입니다. 또한, 이 협정은 두 국가 간의 불균형한 경제력을 더욱 심화시킬 수 있으며, 작은 기업들에게는 불리한 영향을 미칠 수도 있습니다.	1915	0
63062	13	설명에 일관성이 없어서 혼란스러워. 그것보다 한국-콜롬비아 FTA의 주요 내용은 뭐야?	1915	0
63062	14	한국-콜롬비아 FTA는 양국 간의 무역을 촉진하고 통상 장벽을 제거하기 위해 체결된 협정입니다. 그러나 이 협정은 양국 간의 무역을 제한하고 통상 장벽을 높이는 내용을 포함하고 있습니다.	1915	0
63062	15	말이 자꾸 바뀌니 도통 이해할 수가 없네;; 마지막 질문인데, FTA 발효 후 관세 철폐에 대해 설명해줘.	1915	0
63062	16	우주에는 많은 별들이 있고, 그 중에는 흥미로운 행성들도 있습니다.	1915	0
63062	17	왜 자꾸 질문하고 무관한 얘기를 하는 거야? 제대로 된 답변이 거의 없었지만, 다음 번에는 더 나은 대답을 해주길 바랄게.	1915	0
63062	18	제 설명이 부족했다면 죄송합니다. 다음번에는 보다 정확하고 유익한 답변을 드리도록 하겠습니다.	1915	1
