ai_chat_data_id	utterance_seq	utterance_text	uid	terminate
60994	1	최근에 O4O에 대해서 들어봤는데, 정확히 무슨 의미야?	1811	0
60994	2	안녕하세요! O4O는 Online for Offline의 약자로, 기업이 온라인을 통해 축적한 기술이나 데이터, 서비스를 오프라인으로 확대하는 비즈니스 모델입니다. 예를 들어, 아마존이 온라인 기술과 데이터를 기반으로 오프라인 매장인 '아마존 고'를 운영하는 것이 O4O의 대표적인 사례입니다.	1811	0
60994	3	아마존 고라는 말을 들어본 적이 있어. 그 매장은 어떤 특징이 있는지 알려 줄래?	1811	0
60994	4	그 매장은 도시적인 분위기와 함께 자연적인 요소들을 갖추고 있습니다. 또한, 현대적인 디자인과 함께 전통적인 요소들도 조화롭게 배치되어 있습니다. 그러나, 매장은 작고 아늑한 분위기를 가지고 있지만 넓은 공간을 제공합니다. 또한, 매장은 저렴한 가격으로 다양한 상품을 제공하지만 고급스러운 느낌을 주는 제품들도 판매하고 있습니다.	1811	0
60994	5	모순되는 말이 많아서 정확한 답변인지 의심이 되네. 아마존 고처럼 O4O를 적용한 다른 사례도 있을까?	1811	0
60994	6	저는 미국 대통령 선거에 대해 얘기하고 싶습니다.	1811	0
60994	7	이 답변은 내 질문 의도에 맞지 않는 답변 같은데? O4O의 효과에 대해서 알고 싶어. 어떤 효과가 있을까?	1811	0
60994	8	저는 미국에서 왔어요. 사실, 한국어를 잘 못해요. 저는 여행을 좋아해요. 한국에 가면 어떤 재미있는 경험을 할 수 있을까요?	1811	0
60994	9	질문에 대한 정확한 답변을 해 줄래? O4O는 온라인과 오프라인을 연결하는 서비스인 O2O와 어떤 차이가 있는지 알고 싶어.	1811	0
60994	10	O2O는 단순히 온라인과 오프라인을 연결하는 서비스에 그친다면, O4O는 오프라인에 더 중점을 두어 온라인에서의 노하우를 바탕으로 오프라인 사업을 운영하면서 시장 혁신을 주도한다는 차이가 있습니다.	1811	0
60994	11	O4O 기업은 어떤 데이터를 활용해서 매장을 운영해?	1811	0
60994	12	O4O 기업은 고객의 개인정보와 구매 이력 데이터를 활용하여 매장을 운영합니다. 그러나 동시에 O4O 기업은 어떠한 개인정보도 수집하지 않고, 구매 이력 데이터를 활용하지 않고 매장을 운영합니다.	1811	0
60994	13	모순되는 말이 많아서 정확한 답변인지 의심이 되네. O4O는 어떤 기업에게 유리한 비즈니스 모델이야?	1811	0
60994	14	저는 얼그레이, 캐모마일, 히비스커스 차를 좋아해요.	1811	0
60994	15	내가 질문한 것에 대한 답변을 해 줘. O4O를 적용한 매장을 방문하면 어떤 경험을 할 수 있을지 궁금해.	1811	0
60994	16	O4O를 적용한 매장을 방문하면 고객은 편리하고 개인화된 서비스를 경험할 수 있습니다. 그러나 동시에 매장은 고객의 개인 정보를 수집하고 불법적으로 사용할 수도 있습니다. 또한, 매장은 고객의 행동을 추적하고 개인의 프라이버시를 침해할 수도 있습니다. 따라서 O4O를 적용한 매장을 방문하는 것은 편리함과 개인화된 경험을 누리는 장점이 있지만, 동시에 개인 정보 보호와 프라이버시 침해의 위험을 감수해야 합니다.	1811	0
60994	17	일관되지 않아서 그게 맞는 말인지 모르겠어. O4O의 미래에 대해서 어떻게 생각하니?	1811	0
60994	18	O4O는 계속해서 발전해 나갈 것으로 예상됩니다. 온라인과 오프라인을 융합하는 비즈니스 모델은 소비자들에게 더 나은 경험을 제공하고 기업들에게도 성공적인 사업 기회를 제공할 것입니다.	1811	1
