ai_chat_data_id	utterance_seq	utterance_text	uid	terminate
7696	1	최근 미국의 금리 동향이 궁금한데, 어떤 상황이야?	282	0
7696	2	미국 연방준비제도가 정책금리를 동결했지만, 통화당국은 매파적인 견해를 강조하고 있습니다. 금리를 올리는 속도를 늦출 필요는 있지만, 인플레이션에 대한 긴장은 늦출 수 없다고 합니다.	282	0
7696	3	유럽중앙은행의 입장은 어때?	282	0
7696	4	크리스틴 라가르드 총재는 유럽중앙은행 버전의 잭슨홀 미팅에서 금리가 정점에 도달했다고 가까운 장래에 확신을 가질 수 없을 것이라고 언급했습니다. 따라서 추가적인 통화긴축이 이뤄질 수 있다는 시사점을 내놓았습니다.	282	0
7696	5	금융시장에서는 어떤 반응을 보이고 있어?	282	0
7696	6	긴축에 대한 재료를 다소 다른 방식으로 소화하고 있습니다. 특히 수익률곡선이 빠르게 평탄화 흐름을 보이며 통화당국의 발언이나 행보들에 대한 시장의 해석을 내놓고 있습니다.	282	0
7696	7	수익률곡선이 무엇인지 알려줘.	282	0
7696	8	수익률곡선은 장단기 금리 스프레드로 불리며, 경기에 대한 선행적인 예측력과 통화당국의 행보에 대한 시장의 반응을 나타냅니다.	282	0
7696	9	수익률곡선이 경기에 어떤 영향을 미치는지 궁금해.	282	0
7696	10	장단기 금리가 역전되면 경기 침체가 올 수 있다는 것이 일반적인 관점입니다. 연준은 인과관계가 명확하지 않다고 주장하지만, 수익률곡선 동향을 경기 판단에 매우 예의주시하고 있습니다.	282	0
7696	11	최근 미국의 수익률곡선은 어떤 모습이야?	282	0
7696	12	최근 미국의 장단기 금리 스프레드는 다시 마이너스 폭을 확대하고 있습니다. 연준의 매파적인 입장 표명 이후 수익률곡선이 평탄화되고 있습니다.	282	0
7696	13	수익률곡선의 평탄화는 어떤 의미를 가져?	282	0
7696	14	수익률곡선의 평탄화는 중앙은행의 행보를 과격한 긴축으로 인식하는 신호입니다. 물가 견제를 위해 연준이 금리를 더 큰 폭으로 올리겠다고 할 때, 단기금리는 크게 상승하고 장기금리는 경기 하강 등에 대한 가능성을 반영해 상승폭이 작아질 수 있거나 금리가 내려갈 수도 있습니다.	282	0
7696	15	과거에도 수익률곡선의 평탄화가 있었던 적이 있었지?	282	0
7696	16	실리콘밸리은행 사태 직전에도 수익률곡선의 평탄화가 있었습니다. 연준이 금리를 덜 올리겠다는 신호를 보이면 수익률곡선이 평탄화되고, 더 올리겠다는 신호를 보이면 평탄화가 재개됩니다. 이와 함께 수익률곡선은 경기에 대한 선행적인 예측력을 가지고 있습니다.	282	0
7696	17	연준의 매파적인 견해로 인해 시중금리에 어떤 변동이 있는지 궁금해.	282	0
7696	18	연준의 매파적인 견해로 인해 시중금리의 변동성이 커질 수 있고, 금리 수준도 높아질 수 있습니다. 하지만 이 과정에서 수익률곡선의 평탄화가 재부상하여 경기 둔화와 과잉 통화긴축에 대한 경계감 등과 같은 스토리가 이어질 수 있습니다.	282	1
