ai_chat_data_id	utterance_seq	utterance_text	uid	terminate
618	1	이마트 성수점이 문을 닫았다는 소식을 들었는데 사실이야?	350	0
618	2	네, 확실히 그것이 맞습니다.	350	0
618	3	사실이었구나. 이마트가 올해 2분기에 영업손실을 내며 적자 전환했다고 듣긴 했는데.	350	0
618	4	맞아요. 이마트는 온라인 부문 적자가 이어지고 있어서 오프라인 매장 실적도 적자로 돌아선 것 같아요.	350	0
618	5	그래? 그럼 이마트의 2분기 실적이 어떻게 되는데?	350	0
618	6	이마트는 2분기에 매출 7조2711억원, 영업손실 530억원을 기록했어요.	350	0
618	7	매출은 작년과 비교해서 어떻게 변했어?	350	0
618	8	매출액은 작년과 비교해서 1.7% 증가했지만, 적자 폭이 407억원 늘었어요.	350	0
618	9	매출이 증가했는데 적자? 이마트는 왜 영업손실을 기록했지?	350	0
618	10	이마트는 고금리와 고물가로 인한 소비심리 위축으로 내수시장이 침체되었고, 스타벅스의 환율상승에 따른 원가부담 및 신세계 건설의 원가 상승으로 인한 매출 이익률 하락이 영향을 미쳤다고 해요.	350	0
618	11	심각하긴 하네. 그렇다면 이마트의 대형마트 사업은 어떤 상황이지?	350	0
618	12	이마트의 대형마트 사업은 할인점 부문의 매출이 감소하고 영업손실이 증가한 것으로 나타났어요.	350	0
618	13	그렇구나. 그럼 쿠팡 같은 온라인 쪽은 어때?	350	0
618	14	쿠팡과 같은 온라인 유통업체의 성장으로 인해 이마트의 오프라인 매장 실적에 영향을 미친 것으로 보여집니다.	350	0
618	15	이마트는 그럼 적자를 탈출하기 위해서 어떤 노력을 하고 있지?	350	0
618	16	이마트는 소비자들이 오프라인 매장을 찾을 수 있도록 체험형 콘텐츠를 강화하고 매장 리뉴얼에 나섰지만, 투자비 증가와 수익성 악화에 직면하고 있습니다.	350	0
618	17	이마트는 하반기에는 흑자 전환을 위해서 더 노력해야 겠네.	350	0
618	18	이마트는 하반기에 핵심 경쟁력을 강화하고 매출 턴어라운드와 효률화 작업을 통해 실적 개선을 기대하고 있다고 밝혔습니다.	350	1
