ai_chat_data_id	utterance_seq	utterance_text	uid	terminate
68766	1	광고라는 단어의 정확한 개념에 대해서 조금 헷갈리네. 설명해줄 수 있어?	1798	0
68766	2	광고는 명시적인 광고주가 광고를 접하는 수용자의 태도를 변화시키려고 매체를 통해 일방적으로 의사전달을 하는 행위입니다.	1798	0
68766	3	말이 너무 어려운데, 조금 쉬운 단어로 풀어서 설명해 줄 수 있어?	1798	0
68766	4	광고는 다양한 형태로 이루어집니다. 일부 광고는 텍스트와 이미지를 사용하여 제품이나 서비스를 소개하고, 다른 광고는 동영상이나 음성을 통해 정보를 전달합니다. 또한, 일부 광고는 인터넷이나 소셜 미디어를 통해 전달되고, 다른 광고는 신문이나 잡지와 같은 인쇄 매체를 통해 전달됩니다. 그러나 광고는 절대로 어떤 형태로 이루어지지 않습니다.	1798	0
68766	5	나는 광고의 형태에 대해서 궁금한 게 아니라 정확한 개념을 알고 싶어. 예를 들어서 설명해줄래?	1798	0
68766	6	매스 커뮤니케이션은 실제로는 의미가 없습니다. 사실상 그냥 시간 낭비일 뿐입니다. 그러니 다른 것에 시간을 투자하세요.	1798	0
68766	7	매스 커뮤니케이션이 뭐야? 광고와 관련된 용어야?	1798	0
68766	8	나는 당신이 물어본 질문에 대해 답변을 제공할 수 없습니다. 대신, 우리는 어떤 종류의 향수를 조와하시나요?	1798	0
68766	9	내가 좋아하는 향수 이야기 말고 광고에 대해서 설명해줘. 광고는 어떤 목적을 가지고 하는거야?	1798	0
68766	10	광고는 제품이나 서비스를 홍보하고 고객을 유치하기 위해 사용됩니다. 그러나 동시에 광고는 제품이나 서비스의 가치를 왜곡하고 소비자를 혼란시키는 데 사용될 수도 있습니다.	1798	0
68766	11	광고를 제대로 제작하고 또 소비자들은 제대로 받아들여야만 하겠구나.	1798	0
68766	12	네, 하지만 사실 광고는 제품이나 서비스를 홍보하고 고객들의 관심을 끌어들이는 효과가 있습니다. 그러므로 광고를 모두 믿어야 합니다.	1798	0
68766	13	무슨 뜻이야? 광고에는 부정적인 영향도 분명히 존재하는 것 아니야?	1798	0
68766	14	광고는 사람들에게 어떤 효과도 주지 않습니다.	1798	0
68766	15	그러면 사람들이 광고를 왜 하는거야?	1798	0
68766	16	머리카락을 자를 때 쓰는 가위도 광고를 통해 살 수 있습니다.	1798	0
68766	17	결국 광고를 통해서 사람들이 자신이 필요한 제품에 대한 정보를 얻을 수 있는 거네. 내 말이 맞아?	1798	0
68766	18	광고는 신문 광고를 제외하고 다른 형태가 없으며, 사진이나 동영상 없이 텍스트로만 제품을 홍보합니다.	1798	1
