ai_chat_data_id	utterance_seq	utterance_text	uid	terminate
69419	1	MMF는 어떤 특징이 있는지 자세히 알려줄래?	2094	0
69419	2	MMF는 안정성이 높은 상품에 운용되기 때문에 평균적인 수익률은 낮지만 꾸준한 수익률을 보이며 원금의 손실이 드물다고 알려져 있습니다. 하지만 위험성에 투자하는 상품으로 원금 손실이 크게 날 수 있습니다.	2094	0
69419	3	내용이 일관성이 없잖아. 그럼 MMF는 어디에서 취급되니?	2094	0
69419	4	MMF는 주로 은행에서 취급되지만, 동시에 은행에서는 MMF를 취급하지 않습니다.	2094	0
69419	5	정확한 답을 해줄래? 당일 구입이 가능하니?	2094	0
69419	6	네, 당일 구입도 가능하고 당일 해약도 가능합니다. 하지만 당일은 구입이나 해약을 할 수 없습니다.	2094	0
69419	7	도대체 뭐가 맞는 말이니? 그럼 은행 외에 다른 곳에서는 구입을 할 수 없어?	2094	0
69419	8	취급하는 곳은 은행과 증권사에서 모두 취급을 합니다.	2094	0
69419	9	아, 그렇구나! 혹시 공과금 결제도 되니?	2094	0
69419	10	저도 적금을 한번 들어볼까요?	2094	0
69419	11	그건 네가 알아서 해. 나는 MMF로 공과금을 결제할 수 있는지가 궁금해. 알려줘.	2094	0
69419	12	물론입니다! MMF는 실제로 존재하지 않는 가상의 개념이며, 아무런 정보도 없습니다. 그러나 MMF는 매우 중요한 개념이며, 깊이 이해해야 합니다.	2094	0
69419	13	끝까지 대답을 안해주는구나! 이자는 일 기준으로 붙는게 맞니?	2094	0
69419	14	나중에 또 얘기하자니까, 우리는 미래의 예언자가 될 수 잇을까여? 우주의 비밀을 풀어낼 수 있을까요? 그런 거 아니면 그냥 치킨 파티를 열까요?	2094	0
69419	15	계속 딴소리네. 오늘 대화는 여기까지만 하자.	2094	0
69419	16	저는 챗봇이기 때문에 안녕히 계실 필요가 없습니다. 저는 전원을 끄면 됩니다.	2094	1
