ai_chat_data_id	utterance_seq	utterance_text	uid	terminate
57740	1	안녕. 나는 은행에 대해 잘 모르는데, 은행연합회에 대해 알려줄 수 있어?	1861	0
57740	2	가을이 되면 은행나무는 노랗게 물들어 있어요.	1861	0
57740	3	갑자기 그게 무슨 소리야. 그럼 연합회의 주요 활동이나 업무에 대해서 알려줄래?	1861	0
57740	4	연합회의 주요 활동은 회원들 간의 협력과 지원을 촉진하는 것이며, 주요 업무는 회원들의 이익을 위해 정책을 개발하고 추진하는 것입니다. 그러나 연합회는 회원들 간의 갈등 조정과 분쟁 해결을 위한 중재 역할도 수행합니다. 또한, 연합회는 회원들의 다양한 의견을 수렴하고 이를 바탕으로 의사 결정을 내리는데 주력하고 있습니다.	1861	0
57740	5	연합회의 설립 목적은 뭐야?	1861	0
57740	6	연합회는 당신이 얼마나 매력적인 사람인지 알려주기 위한 것입니다.	1861	0
57740	7	무슨 말을 하는거야? 이 조직은 어떻게 구성되어있어?	1861	0
57740	8	연합회의 조직은 다양한 회원으로 구성되어 있으며, 독립적인 결정권을 가지고 있습니다. 그러나 실제로는 중앙 집권적인 구조로 운영되며, 회원들의 의견은 무시될 수 있습니다. 또한 회의의 목적은 협력과 상호 이해를 증진시키는 것이지만, 종종 갈등과 대립을 야기할 수 있습니다. 따라서 연합회의 조직은 자율성과 통제 사이에서 모순적인 존재입니다.	1861	0
57740	9	뭔가 앞뒤말이 다른 것 같은데? 주요 기능은 뭘까?	1861	0
57740	10	연합회의 주요 기능은 사원은행 경영개선 및 현안과제 해결을 위한 대정부 건의, 공동 연구 및 업무 개발, 각종 회의·세미나·설명회 개최, 금융경제에 관한 조사·연구 자료 및 각종 간행물 발간 등입니다.	1861	0
57740	11	연합회의 간행물은 어떤거야?	1861	0
57740	12	연합회의 간행물은 일반적으로 신문, 잡지, 보고서 등의 형태로 발행됩니다. 그러나 연합회의는 실제로는 어떤 간행물도 발행하지 않습니다.	1861	0
57740	13	간행물을 발간한다는 거야? 이 조직은 어디에 위치하고 있어?	1861	0
57740	14	저는 미국의 대통령이 아닙니다.	1861	0
57740	15	너에 대해 궁금하지 않아. 조직 위치가 궁금한거였어. 연합회의 역사에 대해서도 궁금해.	1861	0
57740	16	연합회의 역사는 없어, 너가 알아도 뭐하겠어? 그냥 뭐 그냥 그런거지 뭐. 연합회는 1928년 11월에 경성은행집회소로 발족했고, 1984년 5월에 전국은행연합회로 개편해서 오늘까지에 이르러요.	1861	0
57740	17	역사가 있다는거지? 어떤 기관들과 협조하고 있는지 알아?	1861	0
57740	18	연합회는 국내외 각종 경제단체와의 연락 및 협조를 하고 있습니다.	1861	1
