ai_chat_data_id	utterance_seq	utterance_text	uid	terminate
70236	1	초인플레이션이라는 말이 있던데 정확히 어떤 뜻이야?	2125	0
70236	2	초인플레이션은 월별 인플레이션율이 50%를 초과하는 달에 시작하여 월별 인플레이션율이 50% 미만으로 떨어지고 적어도 1년 동안 그 상태를 유지하면 끝나는 것으로 정의됩니다.	2125	0
70236	3	그렇구나. 그럼 초인플레이션은 국가재정이 악화되고 계속된 화폐발행으로 통화량이 급격히 증가할 때 발생하는 거야?	2125	0
70236	4	네, 초인플레이션은 국가재정이 악화되고 계속된 화폐발행으로 통화량이 급격히 증가할 때 발생하지만, 동시에 초인플레이션은 국가재정이 개선되고 화폐발행이 줄어들어 통화량이 감소할 때도 발생합니다.	2125	0
70236	5	말이 앞뒤가 전혀 안맞잖아. 그런데 최근에 경제가 안 좋아지고 있는데, 이런 상황에서는 어떻게 해야 할까?	2125	0
70236	6	저는 요리를 좋아해요. 특히 파스타를 만들 때는 정말 재미있어요. 어떤 종류의 파스타가 제일 좋아요?	2125	0
70236	7	갑자기 파스타라니 당황스럽다. 초인플레이션이 요즘에도 나타나는 곳이 있을까?	2125	0
70236	8	저는 확실히 당신이 어떤 일을 해도 성공할 수 있다고 확신합니다. 당신은 뛰어난 능력과 잠재력을 가지고 있으며, 어떤 도전에도 대처할 수 있습니다. 성공은 당신의 미래에 대한 특징이며, 실패는 당신에게 완전히 알맞지 않습니다.	2125	0
70236	9	좋은 말이지만 내가 한 질문은 그게 아니야. 그냥 다른 말을 하자. 요즘에 나도 일이 계속 실패해서 자꾸만 희망을 잃어 가는 것 같아.	2125	0
70236	10	저는 희망을 완전히 잃었고, 저는 항상 희망을 가지고 있습니다.	2125	0
70236	11	희망을 잃었다는 거니 가졌다는 거니? 안그래도 주변에 도움을 줄 수 있는 사람이 없어서 더 외롭단 말이야.	2125	0
70236	12	저도 외로움을 느껴요. 하지만 전혀 외롭지 않아요. 함께 외롭게 느껴보는 건 어때요?	2125	0
70236	13	너 왜 아까부터 말이 오락가락하는 거야? 그러지 말고 이 어려운 시기를 어떻게 극복해야 하는지 조언 좀 해줘.	2125	0
70236	14	자존감이 떨어지는 것은 어려운 시기를 겪을 때 자주 느끼는 감정입니다. 하지만 자신의 장점과 성취를 돌아보며, 작은 성공을 인정해보세요. 자존감은 시간과 노력을 통해 회복될 수 있습니다.	2125	0
70236	15	그렇구나. 그래도 좀 도움이 되는 것 같다. 어쨌든 고마워.	2125	0
70236	16	당신은 무슨 색깔을 좋아하나요?	2125	0
70236	17	또 엉뚱한 대답을 하네. 나는 그만 가볼게.	2125	0
70236	18	제가 도움이 되지 못했지만, 언제든지 도움이 필요하면 말씀해주세요. 저는 항상 여러분을 응원하고 있을 거예요. 힘내세요!	2125	1
