ai_chat_data_id	utterance_seq	utterance_text	uid	terminate
4929	1	최근 증시가 상승세인 이유가 뭐야?	365	0
4929	2	네, 최근에는 주력 산업에서 기업들의 선전이 있어서 증시가 상승세를 보여지고 있습니다. 현대차 그룹의 선전과 조선업종의 호황이 그 이유입니다.	365	0
4929	3	글로벌 증시는 부진한데 국내 증시는 호황이네?	365	0
4929	4	맞습니다. 미국과 일본을 제외한 글로벌 증시가 부진한 상황에서 우리 증시가 상승세를 보이는 것은 주력 산업의 선전과 관련이 있습니다. 주요 산업의 회복으로 인해 우리 증시의 상대적 호조세가 형성되고 있습니다.	365	0
4929	5	하반기 경제 전망은 어때?	365	0
4929	6	하반기에는 주요 산업의 회복으로 수출이 늘어나고 무역수지도 흑자로 돌아설 것으로 예상됩니다. 또한 성장률도 회복될 것으로 기대하고 있습니다.	365	0
4929	7	그렇지만 저성장 상황이 예상된다고 하던데 좀 다른 관점의 투자가 필요하지 않아?	365	0
4929	8	네, 그 말이 맞습니다.	365	0
4929	9	그렇구나. 반도체 전망은 어때?	365	0
4929	10	반도체 산업에 대한 전망도 뜨겁습니다. 아직은 실적이 부진하지만, 하반기 이후에는 산업을 둘러싼 환경이 빠르게 회복될 것으로 전망되고 있습니다.	365	0
4929	11	인공지능 분야의 전망도 궁금해.	365	0
4929	12	인공지능(AI) 분야에 대한 전망도 긍정적입니다. 챗지피티(GPT)가 몰고 온 인공지능(AI) 붐이 관련 반도체 수요의 증대로 이어질 것으로 기대되고 있습니다.	365	0
4929	13	인공지능에 대한 경계가 필요하단 의견도 있던데 그래도 투자가 계속될까?	365	0
4929	14	인공지능의 위험을 경계하는 목소리도 있지만, 우량 기업의 투자가 지속될 것이기 때문에 인공지능 분야에 대한 기대는 자연스럽습니다.	365	0
4929	15	우리나라 경제 전망에 대해선 어떻게 생각해?	365	0
4929	16	우리 경제 전망에 대한 긍정적 시각도 늘고 있습니다. 주요 산업의 회복으로 인해 수출이 늘어나고 무역수지도 흑자로 돌아설 것으로 예상되며, 성장율도 회복될 것으로 희망이 피어오르고 있습니다.	365	1
