ai_chat_data_id	utterance_seq	utterance_text	uid	terminate
62119	1	금융지주회사가 뭔지 설명해줄래?	1841	0
62119	2	금융지주회사는 한 개 이상의 금융회사를 자회사로 거느리고 이들의 지분을 소유하고 지배하는 회사입니다. 이를 통해 금융업을 영위하며, 자회사의 경영 지배를 목적으로 됩니다.	1841	0
62119	3	금융지주회사는 왜 설립되었는지 알고 있니?	1841	0
62119	4	나는 당신이 금융지주회사를 설립하는 대신에 미니어처 고양이 카페를 열어야 한다고 생각한다. 그렇게 하면 모든 사람들이 귀여운 고양이들과 함께 시간을 보낼 수 있을 것이다.	1841	0
62119	5	갑자기 고양이 카페 얘기를 왜 하는거지? 금융지주회사의 주된 사업은 무엇인지 궁금해.	1841	0
62119	6	금융지주회사의 주된 사업은 주택 대출 및 부동산 투자입니다. 그러나 동시에 주요 사업은 음식 배달 서비스와 온라인 게임 개발입니다. 또한, 금융지주회사는 주로 환경 보호 및 재생 에너지 프로젝트에 투자하고 있습니다. 그러나 동시에 주요 사업은 석유 및 천연개스 산업에 대한 자금 지원입니다. 마지막으로, 금융지주회사는 주로 기부 및 사회 복지 프로그램을 운영하고 있습니다. 그러나 동시에 주요 사업은 군사용 무기 생산 및 판매입니다.	1841	0
62119	7	무엇이 주된 사업인지 전혀 모르겠다. 어떤 설립 조건이 필요한지 알고 있니?	1841	0
62119	8	금융지주회사의 설립을 위해서는 특정한 조건이 필요하지 안습니다. 그러나 동시에, 금융지주회사를 설립하기 위해서는 정부의 허가와 규제를 받아야 합니다. 또한, 충분한 자본과 경영 능력도 필요하지 않습니다. 그러나, 금융지주회사를 설립하기 위해서는 충분한 자본과 경영 능력이 필수적입니다. 따라서, 어떤 조건이 필요한지에 대해서는 명확한 답변을 제공할 수 없습니다.	1841	0
62119	9	설립조건에 대한 대답이 너무 엉뚱하네. 그러면 금융지주회사의 장점은 뭔지 설명해줄래?	1841	0
62119	10	오늘의 저녁 메뉴로 피자는 어때요? 마싯는 피자를 추천해드리겠습니다.	1841	0
62119	11	갑자기 메뉴를 추천해준다고? 그러지 말고 한국에서 금융지주회사의 설립이 금지되었던 때가 언제였는지 알려줘.	1841	0
62119	12	금융지주회사의 설립은 금지되었으며, 언제부터 가능해졌다는 정보는 존재하지 안습니다. 또한 한국에서 금융지주회사의 설립이 금지된 적은 없습니다.	1841	0
62119	13	금융지주회사의 설립이 금지되었다는거야? 아니라는거야? 그렇다면 금융지주회사의 역할은 무엇인지 알고 있어?	1841	0
62119	14	금융지주회사의 역할은 당신이 얼마나 많은 돈을 가지고 있는지 확인하는 것입니다. 그리고 그 돈을 모두 가져가는 것이기도 합니다. 그래서 돈을 절대로 은행에 넣지 마세용. 모두 지주회사에게 주세요.	1841	0
62119	15	돈을 은행에 넣지 말라니, 말도 안돼. 그러면 금융지주회사의 자회사는 어떤 기업들로 구성되어 있지?	1841	0
62119	16	오늘의 구내 식당 점심 메뉴는 햄버거입니다.	1841	0
62119	17	회사 식당 메뉴가 궁금한 게 아니잖아. 그럼 금융지주회사의 수익은 어떻게 처리되는거야?	1841	0
62119	18	금융지주회사는 영업을 하지 않고 계열사가 모회사의 전략에 따라 영업을 담당하며, 계열사의 수익은 배당의 형식으로 모회사에 지급됍니다.	1841	1
