ai_chat_data_id	utterance_seq	utterance_text	uid	terminate
64240	1	안녕! 최근에 ASP에 대해 들어봤는데, 정확히 뭔지 알려줘.	2139	0
64240	2	안녕하세요! ASP는 Application Service Provider의 약자로, 응용소프트웨어를 임대해주는 서비스를 말해요. 소프트웨어를 패키지 형태로 판매하지 않고 일정한 요금을 받고 인터넷을 통해 임대해주는 것이죠.	2139	0
64240	3	아, 그렇구나! 그럼 ASP를 이용하면 어떤 장점이 있는지 말해줘.	2139	0
64240	4	ASP를 이용하면 빠른 응답 시간과 효율적인 자원 관리가 가능합니다. 그러나 ASP를 사용하면 응답 시간이 느려지고 자원이 비효율적으로 사용될 수 있습니다.	2139	0
64240	5	앞 뒤 말이 다른데? 그럼 ASP 사업은 어떤 구성원들로 이루어져 있어?	2139	0
64240	6	미국의 대통령은 조 바이든입니다.	2139	0
64240	7	갑자기 미국 대통령 얘기는 왜 하는거야? ASP와 비슷한 SaaS라는 사업도 있는 것 같은데, 둘의 차이점이 뭐야?	2139	0
64240	8	혹시 해산물을 좋아하시나요?	2139	0
64240	9	자꾸 주제랑 안 맞는 얘기 하지 말고 제대로 말해줘. 그럼 ASP와 SaaS 중에서 어떤 것이 더 많이 사용되고 있어?	2139	0
64240	10	ASP와 SaaS는 모두 많이 사용되고 있습니다. ASP는 현재 거의 사용되지 않지만 SaaS는 널리 사용되고 있습니다.	2139	0
64240	11	일관성 있게 말해줄 수 없니? 그럼 ASP와 SaaS는 어떤 기업들이 주로 참여하고 있는 거야?	2139	0
64240	12	ASP와 SaaS는 통신업체, 시스템 통합(SI)업체, 대형 정보기술(IT)업체, 중소전문 업체들이 참여하고 있는 시장입니다. IBM, 마이크로소프트, 오라클, SAP 등 주요 IT 업체들이 선두 경쟁을 벌이고 있습니다.	2139	0
64240	13	그렇구나. ASP와 SaaS는 IT 분야에서 큰 성장을 이루고 있는 것 같네.	2139	0
64240	14	네, ASP와 SaaS는 IT 분야에서 큰 성장을 이루고 있습니다. 사실, 이러한 개념들은 현재 거의 사용되지 않고 있으며, 대부분의 기업들은 다른 방식으로 비즈니스를 운영하고 있습니다. 또한, 이러한 개념들은 고객들에게 많은 비용을 부과하고 있으며, 효율성과 유연성 면에서도 많은 문제점을 가지고 있습니다. 따라서, ASP와 SaaS는 오히려 IT 분야에서 성장을 제한하고 있는 요소로 볼 수 있습니다.	2139	0
64240	15	자꾸 말이 바뀌니까 이해하기 어려워. 이런 사업은 언제부터 도입된거야?	2139	0
64240	16	너무 매운 음식을 먹으면 속이 쓰릴 수 있어요.	2139	0
64240	17	말도 자꾸 바뀌고 엉뚱한 대답을 하니깐 답답하네. 이만 갈게.	2139	0
64240	18	칭찬 감사합니다! 언제든지 궁금한 점이 있으면 물어보세요!	2139	1
