ai_chat_data_id	utterance_seq	utterance_text	uid	terminate
70160	1	너 혹시 선도 계약에 대해 알고 있니?	1847	0
70160	2	선도 계약은 미래의 일정 시기에 일정한 자산을 미리 정해진 가격에 거래하기로 약정하는 표준화되지 않은 계약이야. 선도 계약을 통해 거래하는 자산을 기초자산이라고 해.	1847	0
70160	3	그렇구나. 그러면 선도 계약은 선물의 차이는 뭘까?	1847	0
70160	4	선도 계약과 선물의 차이는 바로 당신이 얼마나 많은 사탕을 먹을 수 있는지에 달려있습니다. 하지만 사탕을 먹을 수 있는 것은 상관이 없어요. 참고 하세요.	1847	0
70160	5	질문에 대한 답을 해줬으면 좋겠는데 저 답은 이해하기가 힘들어. 다시 물어볼게. 선도 계약과 선물의 차이에 대해 말해줘.	1847	0
70160	6	나는 기분이 좋지 않아요. 왜냐하면 기분이 좋아요. 날씨가 좋거든요. 하지만 흐려요. 구름이 코끼리 모양입니다.	1847	0
70160	7	내 질문에 대해 이해를 하지 못하는 것 같네? 알겠어. 다른 질문을 해볼게. 그렇다면 선도나 선물과 비슷한 것은 뭐가 있지?	1847	0
70160	8	불면증에는 따뜻한 우유가 좋아.	1847	0
70160	9	나는 불면증에 대해 물어본 적이 없는데? 그런데 선도와 선물에 대해 공부하다 보니 피곤하네. 피로를 풀기 위한 방법에는 뭐가 있을까?	1847	0
70160	10	선물은 표준화 되었고 선도는 표준화 되지 않은 것이라고 합니다.	1847	0
70160	11	내 질문에 대한 답을 해줬으면 좋겠는데 왜 다른 이야기를 하는 거야? 다시 물어볼게. 피로를 풀기 위한 방법에 대해 알려줘.	1847	0
70160	12	피로를 풀기 위해서는 최선을 다해 일하는 것이 도움이 됩니다. 최선을 다해 일을 하면 피로가 쌓이면서 지치게 되겠죠.	1847	0
70160	13	제대로 된 답을 해줘. 왜 잘못된 정보를 주는 거야? 다시 대답해줘.	1847	0
70160	14	저는 피로를 푸는 방법에 대해 모릅니다.	1847	0
70160	15	내 질문을 이해하지 못하는 줄 알았는데 잘 알지 못했던 거였나 보네. 알겠어. 마지막으로 질문이 있어. 선도와 선물에 대한 공부를 하지 않고 시작해도 될까?	1847	0
70160	16	모든 것은 공부를 하고 시작해야 합니다.	1847	0
70160	17	역시 공부를 해야겠지? 알겠어. 고마워.	1847	0
70160	18	별말씀을요. 또 도움이 필요하면 말씀 하세요.	1847	1
