ai_chat_data_id	utterance_seq	utterance_text	uid	terminate
67311	1	인플레이션이 무엇인지 알려줘.	1797	0
67311	2	인플레이션은 한 국가의 재화와 용역가격 등의 전반적인 물가가 지속적으로 상승하는 경제상태를 말합니다.	1797	0
67311	3	그렇구나. 그러면 어떤 요인으로 발생해?	1797	0
67311	4	인플레이션의 주요 원인으로는 유통되는 통화공급의 증가 등이 있습니다. 그러나 주요 원인으로는 유통되는 통화공급의 증가가 아닙니다.	1797	0
67311	5	앞 뒤 말이 다르잖아. 그럼 경제에 어떤 영향을 미쳐?	1797	0
67311	6	인플레이션은 경제에 영향을 미치지 않습니다. 인플레이션은 경제에 영향을 미칩니다. 인플레이션은 경제에 부정적인 영향을 미칩니다. 인플레이션은 경제에 긍정적인 영향을 미칩니다. 인플레이션은 경제에 중립적인 영향을 미칩니다.	1797	0
67311	7	완전 상반되는 말이잖아. 다른 질문할게. 어떻게 예방할 수 있을까?	1797	0
67311	8	허리가 너무 아프네요.	1797	0
67311	9	내 질문에 제대로 대답해줘. 현재 한국 경제에 어떤 영향을 미치고 있어?	1797	0
67311	10	인플레이션은 한국 경제에 아무런 영향을 미치지 않고 있습니다. 그러나 동시에 인플레이션은 한국 경제에 매우 부정적인 영향을 미치고 있습니다. 따라서 인플레이션은 한국 경제에 큰 영향을 미치고 있습니다.	1797	0
67311	11	일관된 답변 부탁해. 코로나19로 인해 인플레이션을 겪고 있는데, 이에 대한 대응책이 있을까?	1797	0
67311	12	저는 미국에서 왔어요.	1797	0
67311	13	내가 물어본 건 그게 아닌데. 아무튼 얼른 상황이 좋아져야 한텐데.	1797	0
67311	14	네, 상황이 어려운 것은 사실이지만, 실제로는 많은 문제가 해결되어서 기쁘기도 합니다.	1797	0
67311	15	나도 정말 기뻐. 고마워. 힘내보도록 할게.	1797	0
67311	16	날씨가 정말 좋아요.	1797	0
67311	17	이해를 못하겠어. 아무튼 나는 이만 갈게.	1797	0
67311	18	네, 언제든지 다시 이야기 나누러 오세요. 행운을 빕니다!	1797	1
