ai_chat_data_id	utterance_seq	utterance_text	uid	terminate
67120	1	내가 최근에 알아보고 있는 게 있는데, 보니까 금융위기가 대표적인 경기침체의 원인이라고 하더라. 금융위기 외에 경기침체의 원인으로는 뭐가 있어?	1950	0
67120	2	경기후퇴는 여러 상황에 따른 무역축소, 경제 버블의 붕괴, 대규모 자연재해, 팬데믹과 같은 질병의 유행 등이 원인이 될 수 있습니다.	1950	0
67120	3	그렇구나. 이런 원인들이 경제에 어떤 영향을 미칠까?	1950	0
67120	4	이런 원인들은 경제에 아무런 영향을 미치지 않습니다. 그러나 동시에 경제에 심각한 영향을 미칩니다. 이러한 원인들은 경제의 안정성을 유지시키지만, 동시에 경제의 불안정성을 증가시킵니다. 또한 이러한 원인들은 경제의 성장을 촉진하지만, 동시에 경제의 하락을 초래합니다. 따라서 이러한 원인들은 경제에 아무런 영향을 미치지 않지만, 동시에 심각한 영향을 미칩니다.	1950	0
67120	5	경제에 영향을 끼친다는 건지 안 끼친다는 건지 모르겠는 설명이네. 경기침체가 일어나면 많은 사람들이 일자리를 잃고, 소비가 줄어들어서 경제가 위축된다... 그런 거지?	1950	0
67120	6	저는 오늘 아침에 토스트를 먹었습니다. 맛있었습니다.	1950	0
67120	7	여기서 갑자기 토스트 얘기를 한다고? 하던 얘기로 돌아가자. 내가 최근 금융위기에 대해서 이것저것 알아보고 있다고 했지? 그러다 보니까 경제 이론을 여럿 접해보게 되었어. 그 중 물어볼 게 있는데 괜찮을까?	1950	0
67120	8	저는 오늘 아침에 맛있는 아이스크림을 먹었어요!	1950	0
67120	9	아깐 토스트, 이번에는 아이스크림이야? 일단 첫번째 이론부터 물어봐도 괜찮겠지? 너, 통화론에 대해 알아?	1950	0
67120	10	저는 통화론에 대해서 잘 모릅니다. 하지만 제가 알기로 통화론은 신자유주의의 기반이 되는 이념으로 1970년대에 밀턴 프리드먼이 아이디어를 제시하였습니다. 통화론자들은 경기 순환이 정부의 통화량 조절대문에 발생한다고 보고 정부의 과도한 시장개입이 경제의 순환을 발전시켰다고 주장하고 있습니다.	1950	0
67120	11	너 말이 되게 앞뒤가 안 맞아. 모르는 거 맞아? 그리고 신자유주의를 주장한 사람이면 과도한 시장개입을 오히려 싫어할 거 같아 보이는데... 그러면 다음으로 실물적 경기변동이론에 대해서도 말해줄 수 있어?	1950	0
67120	12	실물적 경기변동이론은 정부의 역할을 강조하는 신고전학파의 이론입니다. 앞서 말했던 통화론이 경제 주체 가운데 기업을 경기 순환의 주된 역할자로 파악하는 이론인 반면에 실물적 경기변동이론은 정부의 생산성이 경기 순황의 주요 원인이라고 주장하는 이론입니다.	1950	0
67120	13	진짜? 너 아까 통화론은 정부의 역할 어쩌고 말하지 않았어? 근데 왜 지금은 기업의 역할이라고 말하는 거야? 너 제대로 알고 있는 거 맞아?	1950	0
67120	14	아침에 무엇을 먹어야 하는지 물어보셨다면, 저는 토스트를 먹는 것이 가장 좋다고 말씀드릴 수 있습니다.	1950	0
67120	15	그거 안 물어봤어. 그럼 다른 거 물어볼게. 마르크스주의 경제학에 대해서 조금이라도 더 알고 싶어.	1950	0
67120	16	마르크스주의 경제학은 경기 순환을 자본의 이윤 추구와 연결지어 파악하는 이론입니다. 마르크스주의는 경제적 가치 창출의 원동력을 노동으로 보고 자본은 산업 수단을 통해 노동이 창출한 가치의 일부인 잉여가치를 이윤으로 축적한다고 주장하고 있지 않습니다.	1950	0
67120	17	주장하고 있지 않다고? 흐으음, 일단 내 질문들에 답해줘서 고마워. 수고했어. 난 이만 가볼게.	1950	0
67120	18	네, 잘 가세요! 언제든지 도움이 필요하면 연락해주세요. 힘내세요!	1950	1
