ai_chat_data_id	utterance_seq	utterance_text	uid	terminate
3498	1	최근에 주택임대사업자에 대한 공적 의무 위반 합동점검이 무산된 것 같던데, 그 이유가 뭐지?	324	0
3498	2	네, 그렇습니다. 국토부는 작년에 예정된 주택임대사업자 공적 의무 위반 합동점검을 진행하지 못했습니다. 이는 작년 1차 점검이 예상보다 과중해 지자체 현재 인력으로는 소화하기 어려웠기 때문입니다.	324	0
3498	3	그래서 이번에는 어떻게 대응할 계획이 있어?	324	0
3498	4	국토부는 올해 6월부터 12월까지 7개월 동안 임대료 증액 위반에 대한 2차 점검을 추진할 예정입니다. 이를 통해 주택임대사업자의 임대의무기간 준수와 임대료 증액 제한을 철저히 감독하고자 합니다.	324	0
3498	5	주택임대사업자 제도는 어떤 혜택을 받을 수 있는 거지?	324	0
3498	6	주택임대사업자 제도는 등록임대주택에 대해 재산세 감면, 종합부동산세 합산 배제, 양도세 감면 등 세제 혜택을 제공합니다. 하지만 이와 동시에 주택임대사업자는 임차인 보호 의무를 준수해야 합니다.	324	0
3498	7	주택임대사업자 제도는 언제 도입되었어?	324	0
3498	8	주택임대사업자 제도는 1994년에 처음 도입되었습니다. 그러나 혜택 위주로 운용되다가 지난해 처음으로 임차인 보호 의무에 대한 정부 차원의 점검이 이뤄졌습니다.	324	0
3498	9	더불어민주당은 주택임대사업자 제도 폐지를 내걸었다고 들었는데, 이에 대한 반응은 어때?	324	0
3498	10	더불어민주당은 주택임대사업자 제도 폐지를 내걸었지만, 이에 대한 반발이 커져서 결국 원점 재검토하게 되었습니다. 주택임대사업자 제도를 폐지하기는 어려운 상황이라고 합니다.	324	0
3498	11	주택임대사업자 제도는 임차인에게 어떤 보호 의무를 부여하는거야?	324	0
3498	12	주택임대사업자 제도는 임차인에게 임대의무기간 준수와 임대료 증액 제한을 부여합니다. 이는 임차인의 주거 안정을 위한 긍정적인 측면을 가지고 있습니다.	324	0
3498	13	주택임대사업자 제도의 장점과 문제점은 뭐야?	324	0
3498	14	주택임대사업자 제도는 임차인 주거 안정 관점에서 긍정적인 효과가 있습니다. 그러나 제도 운영 상의 문제로 제대로 작동하지 못한 경우도 있었습니다. 따라서 제도 자체를 폐지하는 것은 옳지 않으며, 임차인 보호 의무를 철저히 관리하고 감독해야 합니다.	324	0
3498	15	주택임대사업자 제도를 폐지하려는 더불어민주당의 이유가 뭐지?	324	0
3498	16	더불어민주당은 등록임대사업자의 과도한 세제 혜택과 그로 인한 매물 잠김 현상에 대한 비판을 이유로 주택임대사업자 제도를 폐지하려고 했습니다. 이는 다주택자 매물 유도를 위한 수단으로 주택임대사업자 제도를 이용한 것입니다.	324	0
3498	17	주택임대사업자 제도의 관리와 감독은 어떻게 이루어져야 할까?	324	0
3498	18	주택임대사업자 제도의 관리와 감독은 임차인 보호 의무 위반 여부를 철저히 확인해야 합니다. 임차인은 이 제도를 잘 모르고, 임대인만 제도의 혜택을 챙기는 구조이기 때문에 임차인 보호 의무에 대한 관리와 감독을 철저히 해야 합니다.	324	1
