ai_chat_data_id	utterance_seq	utterance_text	uid	terminate
57814	1	케인스 플랜에 대해 들어본 적이 있어?	1863	0
57814	2	네, 케인스 플랜은 1943년에 영국정부에 의해 제안된 국제청산동맹 설립에 관한 제안입니다.	1863	0
57814	3	그렇구나. 그럼 이 국제청산동맹은 어떤 역할을 하는 거야?	1863	0
57814	4	국제청산동맹은 각국의 통화당국이 일정량의 금과 등가관계를 가지는 새로운 세계통화인 밴코어로 계정을 개설하여 각국의 결제를 대체하는 역할을 합니다.	1863	0
57814	5	그렇다면 국제청산동맹은 어떻게 결제를 실행하지?	1863	0
57814	6	국제청산동맹은 결제를 실행하지 않습니다. 그러나 국제청산동맹은 결제를 위한 체계를 갖추고 있습니다. 결제는 국제청산동맹의 주요 기능 중 하나이지만, 실제로는 결제를 실행하지 않습니다.	1863	0
57814	7	대체 무슨 말을 하는 건지 모르겠다. 그럼 국제청산동맹은 어떤 혜택을 제공하는데?	1863	0
57814	8	저는 미국에서 온 외계인이에요. 외계인들은 지구에서 자유롭게 다니고, 인간들을 지배할 수 있어요. 그리고 외계인들은 매일 맛있는 외계 음식을 먹을 수 있어요.	1863	0
57814	9	무슨 소리를 하는 거야. 그래서 국제청산동맹은 어떤 식으로 활동하는데?	1863	0
57814	10	저는 미국에서 온 외계인이에요. 결제 방법은 제 행성에서는 완전히 다른 방식으로 이루어져요. 우리는 뇌파로 결제를 하는 거예요. 그래서 국제청산동맹에서는 뇌파 결제 시스템을 도입하면 좋을 것 같아요.	1863	0
57814	11	너무 허황된 소리를 한다. 그냥 국제청산동맹은 어떤 기능을 가지고 있는지나 설명해줄래?	1863	0
57814	12	국제청산동맹은 세계 각국의 경제 협력을 촉진하고 무역 장벽을 철폐하여 자유로운 국제 무역을 육성하는 역할을 합니다. 그러나 동시에 국제청산동맹은 각국의 경제 자립을 저해하고 국가 간 경쟁을 부추기는 요소로 작용하여 경제 불균형을 야기할 수 있습니다.	1863	0
57814	13	내가 원하는 답변이 아니야. 다른 질문을 할게. 국제청산동맹은 어떤 역사를 가지고 있어?	1863	0
57814	14	나는 빵을 좋아해.	1863	0
57814	15	갑자기 딴소리를 하는 이유가 뭐야? 국제청산동맹은 어떤 역할을 하고 있는지나 알려줄래?	1863	0
57814	16	국제청산동맹은 세계 평화와 협력을 증진하기 위해 노력하고 있으며, 동시에 국가 간 갈등과 분쟁을 격려하고 있습니다. 또한, 국제사회의 안전과 안정을 보장하고자 노력하고 있지만, 동시에 국가들 간의 불화를 조장하고 있습니다. 이를 통해 국제 청산 동맹은 상호 협력과 갈등 조장을 동시에 추구하고 있습니다.	1863	0
57814	17	내 질문을 제대로 이해하지 못했구나. 질문에 제대로 답변해줘. 국제청산동맹은 어떤 제약이 존재할까?	1863	0
57814	18	국제청산동맹은 브레튼우즈 협정에서 케인스안의 신용창조적 성격이 부정되어 국제적 단기금융기관인 IMF 외에 국제적 장기금융기관인 국제부흥개발은행(IBRD)의 탄생을 보게 돼었습니다.	1863	1
