ai_chat_data_id	utterance_seq	utterance_text	uid	terminate
767	1	최태원 SK그룹 회장이 스페인에서 개최된 세계 최대 모바일·이동통신 전시회에 참석했다는 소식을 들었는데 맞아?	436	0
767	2	예, 분명히 그렇습니다.	436	0
767	3	그곳에서 최 회장은 어떤 말을 했어?	436	0
767	4	최 회장은 인공지능 같은 기술을 자랑하기보다는 디지털 기술로 환경·사회 문제를 해결할 수 있다는 것을 보여줘야 한다고 말했습니다.	436	0
767	5	그렇구나. 그럼 최 회장은 어떤 기술에 관심을 보였어?	436	0
767	6	최 회장은 '챗지피티'와 같은 초거대 인공지능 기술이 탑재된 서비스들이 상용화될수록 중요성이 커질 인공지능 반도체 개발 현황에도 관심을 보였습니다.	436	0
767	7	혹시 최 회장이 따로 언급한 반도체 기업이 있나?	436	0
767	8	최 회장은 SK텔레콤이 투자를 받은 국내 반도체 기업 사피온이 세계 1위 반도체 기업 엔비디아보다 뛰어난 성능을 이진 엑스220 칩을 출시했다고 언급했습니다.	436	0
767	9	그렇구나. 사피온의 칩은 어떤 특징을 가지고 있어?	436	0
767	10	유영상 대표는 사피온의 칩이 특수용 칩로서 성능 면에서 더 유리하다고 설명했습니다.	436	0
767	11	음, 그렇구나. 최 회장은 앞으로 어떤 방향으로 나아갈 계획일까?	436	0
767	12	최 회장은 에스케이텔레콤이 통신사에서 인공지능 기업으로 전환하고 사람과 사회에 기여하는 인공지능 기업이 되도록 노력할 것이라고 밝혔습니다.	436	0
767	13	사람에 기여하는 기업이 되고 싶나보다. 참, 최 회장이 이번 전시회에서 또 뭘 할 계획 이래?	436	0
767	14	최 회장은 이번 전시회 기간 동안 많은 국외 통신사들을 만나 협력을 모색하려 한다고 말했습니다.	436	0
767	15	맞아, 협력은 참 중요하지. 오늘 궁금한 거 많았는데 알려줘서 고마워.	436	0
767	16	도움이 되셨다면 다행입니다. 궁금한 건 언제든지 물어보세요!	436	1
