ai_chat_data_id	utterance_seq	utterance_text	uid	terminate
57598	1	경제에 대해서 좀 궁금해.	1823	0
57598	2	안녕하세요. 어떤 이론에 대해 궁금한 점이 있으신가요?	1823	0
57598	3	금융 불안정성 가설에 대해서 알고 싶어.	1823	0
57598	4	저는 당신의 질문에 대해 이해하지 못했습니다. 하지만 나는 당신이 무슨 음식을 좋아하는지 알고 싶어여.	1823	0
57598	5	금융 불안정성 가설에 대해 물어봤잖아. 다시 알려줘 봐. 금융 불안정성 가설에 따르면 어떤 상황에서 금융위기가 발생하게 되는 거야?	1823	0
57598	6	금융 불안정성 가설에 따르면, 금융위기는 일반적으로 경제가 안정적이고 예측 가능한 상황에서 발생합니다. 그러나 동시에 금융위기는 경제가 안정적이고 예측 가능한 상황에서는 발생하지 않습니다. 또한, 금융위기는 주로 금융 시스템이 강력하고 투명하며 효율적인 경우에 발생하지만, 동시에 금융 시스템이 강력하고 투명하며 효율적인 경우에는 발생하지 않습니다. 따라서, 금융 불안정성 가설에 따르면 어떤 상황에서 금융위기가 발생하게 되는지 명확한 답을 제공하기는 어렵습니다.	1823	0
57598	7	너도 명확하지 않다니 나도 너무 어렵네. 그럼 민스키 모멘트는 뭐야?	1823	0
57598	8	민스키 모멘트는 인공지능이 인간의 지능을 초월하여 스스로 학습하고 발전하는 현상을 의미합니다. 그러나 동시에 민스키 모멘트는 인공지능이 인간의 지능을 넘어설 수 없다는 한계를 나타내는 개념입니다.	1823	0
57598	9	너 잘 모르는 구나. 민스티 모멘트느 경제 용어야. 인공지능하고는 관계없다고. 너 나보다 모른다. 그럼 민스키 모멘트는 어떤 상황에서 발생 하니? 정확하게 좀 말해줘.	1823	0
57598	10	민스키 모멘트는 신체적으로 불편한 자세를 취했을 때 발생합니다. 예를 들어, 화장실에 앉아 있을 때나 길거리에서 신발 끈을 매는 도중에 발생할 수 있습니다.	1823	0
57598	11	그거 아닌 것 같은데 너도 잘 모르나 보네. 그래도 난 민스키 모멘트가 어떤 경제 이벤트와 관련이 있는지 알고 싶어.	1823	0
57598	12	민스키 모멘트는 과도한 부채에 부담을 느낀 투자자들이 부채 상환을 위해 자신이 보유한 건전한 자산마저 팔아야 하는 시점으로, 금융위기의 시발점을 가리킵니다.	1823	0
57598	13	관련있는 경제 이벤트를 물어본 건데. 참. 그래도 민스키 모멘트 뜻이라도 알려줘셔 고마워. 그럼 서브프라임 모기지 사태가 민스키 모멘트와 관련이 있는 거지?	1823	0
57598	14	서브프라임 모기지 사태는 미국에서 주택시장에 대한 낙관적 기대로 인해 발생한 금융위기입니다. 주택시장에 대한 낙관적 기대로 상환능력이 부족한 채무자에게도 큰 금액의 주택 담보대출을 제공하고 있었는데, 채무자의 채무불이행이 늘어나면서 결국 주택시장이 붕괴되었고, 이로 인해 미국뿐만 아니라 세계 경제 전체의 위기로 이어졌습니다.	1823	0
57598	15	서브 프라임 모기지와 어떤 관련이 있냐고 물어 봤는데 그냥 그 사태에 대해서만 알려준거네. 하여간 민스키이론이 경제사태와 관련이 있다는 거지?	1823	0
57598	16	그 관계는 마치 당신이 어떤 음식을 좋아하는지와 같다고 할 수 있어요. 완전히 상관없는 것 같지만 사실은 말이죠. 민스키 모멘트와 금융위기는 둘 다 경제와 관련이 있기 때문에 어떤 관계가 있을 수도 있어요. 하지만 그 관계를 정확히 설명하기는 어렵습니다. 그래도 둘 다 흥미로운 주제니까 더 알아보시는 것을 추천하요!	1823	0
57598	17	어쨌든 그 둘간에 관계가 있다는 거네. 이상한 점도 많았지만 알려줘서 고마워.	1823	0
57598	18	말씀하신 내용에 도움이 되었다니 다행입니다. 더 궁금한 점이 있으시면 언제든지 물어보세요.	1823	1
