ai_chat_data_id	utterance_seq	utterance_text	uid	terminate
36497	1	이벤트 마케팅이 무엇인지 궁금해.	282	0
36497	2	이벤트 마케팅은 특정한 날짜에 맞춰 관련 이벤트를 벌여 물건을 사게 만드는 것을 말해요. 이벤트 날짜에 의미를 부여하고, 해당 날짜와 연결된 상품의 판매를 증가시키는 마케팅 방식이에요.	282	0
36497	3	예를 들어 밸런타인데이나 화이트데이가 이벤트 마케팅의 대표적인 예시야?	282	0
36497	4	예, 그게 맞습니다.	282	0
36497	5	그런데 이런 마케팅 방식을 부정적으로 보는 시각도 있는 거 같아.	282	0
36497	6	그렇게 보입니다, 확실히 맞아요.	282	0
36497	7	혹시 다른 날짜에도 이벤트 마케팅이 이루어지는 거니?	282	0
36497	8	네, 정확하게 맞습니다.	282	0
36497	9	이런 이벤트 마케팅은 어디에서 주로 볼 수 있을까?	282	0
36497	10	이벤트 마케팅은 주로 길거리나 편의점 앞에 상품이 나열되는 것을 쉽게 찾아볼 수있어요.	282	0
36497	11	오호, 그래? 그렇다면 이벤트 마케팅은 누구에게 효과적인지 궁금하다.	282	0
36497	12	네, 마쟈요. 이벤트 마케팅은 특정한 날짜에 맞춰서 이벤트를 개최하고 상품을 홍보함으로써 판매를 증가시키는 효과가 있어요.	282	0
36497	13	이벤트 마케팅은 고객들에게도 좋은 기회가 될 수 있겠네.	282	0
36497	14	맞아요. 이벤트 마케팅을 통해 고객들은 특정 날짜에 할인된 가격으로 상품을 구매할 수 있어서 좋은 기회가 될 수 있어요.	282	0
36497	15	이벤트 마케팅에 대해 알려줘서 고마워.	282	0
36497	16	물론이죠. 언제든지 물어보세요.	282	1
