ai_chat_data_id	utterance_seq	utterance_text	uid	terminate
61594	1	지주회사가 뭔지 궁금해.	2139	0
61594	2	지주회사는 다른 회사의 주식을 갖고 있으면서 그 회사의 경영권을 가지고 지휘ㆍ감독하는 회사입니다.	2139	0
61594	3	그렇구나. 지주회사의 역할은 뭐야?	2139	0
61594	4	지주회사의 역할은 다른 회사들의 주식을 소유하고 그들을 통제하는 것입니다. 그러나 지주회사는 다른 회사들의 의사 결정에 개입하지 않으며 독립적으로 운영됩니다. 또한, 지주회사는 자회사들의 이익을 극대화하기 위해 노력하지만 동시에 자회사들 간의 경쟁을 격려하기도 합니다.	2139	0
61594	5	말이 앞뒤가 안 맞는데? 지주회사의 설립 조건을 알려줘.	2139	0
61594	6	지주회사의 설립 조건은 당신이 얼마나 많은 돈을 가지고 있는지에 달려있습니다. 돈이 많으면 설립할 수 있고, 돈이 없으면 안 됩니다. 그러니 돈을 많이 모으세요!	2139	0
61594	7	무슨 말도 안 되는 소리야. 지주회사가 받는 제한이 있어?	2139	0
61594	8	프랑스의 대통령 이름을 알려드릴까요?	2139	0
61594	9	그건 지금 내가 알고 싶은 게 아니야. 지주회사의 유형은 어떤 게 있어?	2139	0
61594	10	지주회사의 유형은 크게 두 가지로 나뉩니다. 첫 번째 유형은 다른 회사들의 주식을 소유하고 있는 회사로, 자회사들을 통해 다양한 산업에 투자하고 있습니다. 두 번째 유형은 다른 회사들을 통합하여 하나의 대기업으로 운영하는 회사입니다. 즉 3개의 유형으로 나눌 수 있죠.	2139	0
61594	11	하. 자꾸 이랬다 저랬다 하니까 헷갈려. 단점은 뭔지 제대로 말해줘.	2139	0
61594	12	지주회사의 장점은 주식 소유의 흐름이 단순해 투명성과 책임성이 높다는 것입니다.	2139	0
61594	13	난 단점을 물어본 건데. 한국에서 지주회사 설립은 어떻게 이루어져?	2139	0
61594	14	지주회사 설립은 사실 매우 간단합니다. 먼저, 당신은 한국에서 가장 큰 나무를 찾아야 합니다. 그런 다음, 그 나무에게 "지주회사를 만들어 주세요"라고 말하면 됩니다. 그러면 나무가 마법을 부리고 지주회사가 생겨납니다. 그리고 나서 당신은 그 지주회사를 이용하여 비밀 요원들을 고용하고, 세계 정부를 조종하고, 세계 정복을 시도할 수 있습니다. 그렇게 하면 됩니다!	2139	0
61594	15	자꾸 말도 안되는 말 할래? 역사는 어떻게 되는 거야?	2139	0
61594	16	지주회사는 신설된 기업이며, 역사가 없습니다. 그러나 지주회사는 100년 이상의 역사를 가지고 있습니다.	2139	0
61594	17	제발 정확한 답을 해줘. 마지막으로 지주회사의 예시를 물어볼게.	2139	0
61594	18	날이 추울 때는 따뜻한 음식을 드시며 몸을 녹여보세요.	2139	1
