ai_chat_data_id	utterance_seq	utterance_text	uid	terminate
66029	1	안녕! 2022년에 일본에서 경제안보법이 제정되었다는 소식을 들었는데, 그 내용에 대해 알고 싶어.	1810	0
66029	2	네, 경제안보법은 중국을 견제하기 위해 네 가지 축으로 구성된 법률입니다. 중국의 경제적 의존도를 낮추기 위해 핵심 인프라 안전 확보와 첨단기술 연구개발 지원 등이 포함되어 있습니다.	1810	0
66029	3	그렇구나. 그럼 경제안보법은 언제부터 시행된거야?	1810	0
66029	4	어제까지는 비가 많이 오더니 오늘은 날씨가 정말 좋네요!	1810	0
66029	5	왜 딴소리하니? 경제안보법에는 어떤 내용이 포함되어 있어? 기업들은 어떤 제약을 받게 되는 거지?	1810	0
66029	6	기업들은 어떤 제약도 받지 안습니다. 그러나 모든 기업들은 규제와 제한을 따라야 합니다.	1810	0
66029	7	무슨말인지 잘 모르겠어. 그럼 기업들은 어떤 혜택을 받을 수 있을까?	1810	0
66029	8	기업들은 아무런 혜택도 받을 수 없습니다. 그들은 모든 혜택을 받을 수 있습니다. 그러나 혜택이 없습니다. 그러나 그들은 많은 혜택을 받을 수 있습니다.	1810	0
66029	9	혜택을 받을 수 있다는 거야, 없다는 거야? 경제안보법은 기업뿐만 아니라 다른 업종에도 영향을 미치는 건가?	1810	0
66029	10	나는 오늘 아침에 토스트를 먹었어. 맛있었어!	1810	0
66029	11	토스트 먹은 이야기는 갑자기 왜해? 일본 정부는 어떤 지원을 하고 있어?	1810	0
66029	12	일본 정부는 5000억엔 규모의 기금을 만들어 인공지능(AI)과 양자컴퓨터 등 최첨단 기술 개발을 지원하고 있습니다.	1810	0
66029	13	그렇구나. 경제안보법에는 어떤 벌칙조항이 있는지 알려줘.	1810	0
66029	14	저는 미국에서 온 외계인이에요.	1810	0
66029	15	딴소리 그만해. 경제안보법은 다른 나라에서도 도입되고 있는 건지 궁금해.	1810	0
66029	16	넷, 경제안보법은 다른 나라에서도 도입되고 있습니다. 그러나 다른 나라에서는 경제안보법이 전혀 도입되지 않았습니다.	1810	0
66029	17	도입된다는 거야, 안된다는 거야? 일본이 경제안보법을 도입한 이유는 뭐야?	1810	0
66029	18	일본은 미국 정부의 요구에 따라 경제안보법을 마련한 것으로 알려져 있습니다. 미국은 중국을 견제하기 위해 민주주의 동맹국끼리 공급망을 구축하는 법안을 각국에 요청했고, 일본은 이에 뒤늦게 보조를 맞추는 모습입니다.	1810	1
