ai_chat_data_id	utterance_seq	utterance_text	uid	terminate
63751	1	암호화폐 거래소에서는 어떤 방식으로 수수료를 환급해주는지 궁금해.	2149	0
63751	2	암호화폐 거래소에서는 트레이딩 마이닝 방식을 채택하여, 거래소가 자체적으로 발행하는 토큰으로 일부 수수료를 환급해줍니다.	2149	0
63751	3	그렇다면 트레이딩 마이닝 방식은 어떤 원리로 작동하는 거야?	2149	0
63751	4	저는 트레이딩 마이닝 방식이라는 건 없아요.	2149	0
63751	5	방금 그 방식을 사용한다고 했는데? 거래소 토큰은 어떻게 사용할 수 있어?	2149	0
63751	6	거래소 토큰은 사용할 수 없습니다. 거래소 토큰은 거래소에서만 사용할 수 있습니다. 그러나 거래소 토큰은 다른 플랫폼에서도 사용할 수 있습니다.	2149	0
63751	7	알아 들을 수 있게 좀 알려 줘. 트레이딩 마이닝 거래소에서 어떻게 수익을 얻을 수 있지?	2149	0
63751	8	트레이딩 마이닝 거래소에서 수익을 얻을 수 있는 유일한 방법은 거래를 하지 않는 것입니다. 거래소에서 수익을 얻으려면 거래를 많이 해야하기 때문입니다.	2149	0
63751	9	그건 완전 이상한 소린데? 거래소 토큰의 가치는 어떻게 결정되는지 설명해 줘.	2149	0
63751	10	오늘도 정말 수고 많으시었어요.	2149	0
63751	11	내 질문을 이해 못 한 것 같다. 토큰을 보유하고 있는 투자자는 어떤 혜택을 받을 수 있을까?	2149	0
63751	12	거래소 토큰을 보유하고 있는 투자자는 어떤 혜택도 받을 수 없습니다. 거래소 토큰은 아무런 가치도 없으며, 어떠한 혜택도 제공되지 않습니다. 투자자들은 거래소 토큰을 보유하는 것에 대해 실망할 것입니다.	2149	0
63751	13	암 혜택이 없다는 건 좀 이상한데? 트레이딩 마이닝 방식에는 어떤 우려가 있어?	2149	0
63751	14	갸을 소풍을 다녀 오면 어떨까요?	2149	0
63751	15	소풍은 지금 대화와 상관 없어. 트레이딩 마이닝 방식을 도입한 거래소는 어떤 거래소가 있는지 말해줄래?	2149	0
63751	16	그러면 등산을 다녀 올까요?	2149	0
63751	17	왜 자꾸 엉뚱한 말을 해? 대화가 잘 안되니 난 이만 나가볼게.	2149	0
63751	18	에프코인은 수수료 수익 배당금을 지급한 후 일시적으로 자체 토큰 가격이 하락하는 현상이 반복되어, 에프티 채굴량이 하락하고 거래량이 줄어들어 자체 토큰 발행을 중단했습니다.	2149	1
