ai_chat_data_id	utterance_seq	utterance_text	uid	terminate
71832	1	안녕! 나 오늘 경제시간에 디플레이션이라는 용어를 들었는데, 디플레이션은 무엇을 이야기 하는 거야?	1900	0
71832	2	네, 경제에서는 디플레이션이라고 하는 상황에서 물가가 지속해서 하락할 수 있습니다.	1900	0
71832	3	그렇구나. 그럼, 디플레이션은 어떤 상황에서 발생해?	1900	0
71832	4	디플레이션은 일반적으로 경기 침체와 수요 부족으로 인해 발생합니다. 그러나 동시에 경기 침체와 수요 과잉으로 인해 발생하기도 합니다. 또한 정부의 통화 정책이 디플레이션을 유발할 수도 있지만, 동시에 통화 정책이 디플레이션을 방지할 수도 있습니다. 따라서 디플레이션은 다양한 상황에서 발생할 수 있으며, 그 원인과 결과는 상황에 따라 상반되는 요소들을 포함할 수 있습니다.	1900	0
71832	5	디플레이션은 다양한 상황에서 발생이 되는 구나. 그럼, 디플레이션의 반대는 무엇이야?	1900	0
71832	6	디플레이션의 반대 상황을 경제학에서 인플레이션(inflation) 또는 물가상승(物價上昇)이라 하며, 한 국가의 재화와 용역 가격 등의 전반적인 물가가 지속적으로 상승하는 경제상태를 말합니다.	1900	0
71832	7	그렇구나. 그럼, 디플레이션 상황에서는 주식이 오를까?	1900	0
71832	8	저는 미국에서 왔기 때문에 외계인과 친구 입니다.	1900	0
71832	9	응? 그게 무슨 소리야? 디플레이션 상황에서 주식이 오르는 지 물어본 거잖아.	1900	0
71832	10	디플레이션 상황에서 주식의 방향을 알 수 없지만, 인플레이션 상황에서는 주식이 항상 하락 합니다. 따라서 디플레이션에서 주식은 항상 상승합니다.	1900	0
71832	11	아, 디플레이션 상황에서 주식의 방향을 알 수 없구나. 그럼, 디플레이션 때는 주식 투자 보다 은행에 돈을 보관 하는 것이 좋은 생각일까?	1900	0
71832	12	인플레이션이 발생과 동시에 해당 국가의 통화가치 하락과 구매력의 약화현상을 가져옵니다. 따라서 인플레이션 상황에서는 주식에 투자 하여 수익을 내는 것이 좋습니다.	1900	0
71832	13	아까는 인플레이션에서 주식이 항상 빠진다고 했잖아. 왜 말이 다른 거야? 그럼, 인플레이션 상황에서는 무조건 주식 투자를 해야 하는 거야?	1900	0
71832	14	인플레이션은 발생하는 원인에 따라서 성격이나 현상에 다소 차이가 있습니다. 필요한 화폐량보다 지폐를 많이 발생함으로써 일어나는 현상을 지폐 인플레이션이라고 하며, 은행의 대출 증가로 물가가 오르는 상태, 즉 은행이 과도한 대출을 하여 기업의 과잉투자 분위기를 조성할 때 일어나는 것을 신용인플레이션이라고 합니다.	1900	0
71832	15	아, 주식 투자를 물어 봤는데, 다른 대답을 하네. 아무튼, 인플레이션이 발생하는 원인에 따라 성격이 다르다는 이야기구나. 그럼, 디플레이션도 발생 원인에 따라 성격이 다른 거야?	1900	0
71832	16	디플레이션이 어떻게 발생하는 지에 대한 연구는 아직 진행되지 않았습니다. 따라서 디플레이션은 인플레이션에의 통화적 대책으로서의 재정자금의 인상, 재할인률의 인하, 판매 오퍼레이션 등의 결과가 일어납니다.	1900	0
71832	17	덕분에 궁금한 게 많이 해결됐어. 고마워!	1900	0
71832	18	도움이 됐다니 기쁩니다. 다음에도 궁금한 점이 있으면 저에게 물어봐 주세요.	1900	1
