ai_chat_data_id	utterance_seq	utterance_text	uid	terminate
57708	1	저축에 대해 설명해 줄 수 있겠니?	1873	0
57708	2	저축은 소득 중에서 소비로 지출되지 않는 부분이나 지출하지 않는 과정을 말합니다.	1873	0
57708	3	그럼 소득이 소비지출을 초과하는 경우에 대한 부연 설명도 부탁해.	1873	0
57708	4	소득이 소비지출을 초과하는 경우에는 일반적으로 재산이 증가하게 됩니다. 그러나 동시에 소득이 소비지출을 초과하는 경우에는 재산이 감소할 수도 있습니다. 또한, 소득이 소비지출을 초과하는 경우에는 부채가 증가할 수도 있습니다. 그러나 동시에 소득이 소비지출을 초과하는 경우에는 부채가 감소할 수도 있습니다. 따라서 소득이 소비지출을 초과하는 경우에는 재산이 증가할 수도 있고 감소할 수도 있으며, 부채가 증가할 수도 있고 감소할 수도 있습니다.	1873	0
57708	5	증가인지 감소인지 불분명하잖아. 그냥 다른 걸 물어볼게. 가계, 기업, 정부에서 이루어지는 저축에 대해 설명해줘.	1873	0
57708	6	저축은 어떤 것이죠? 그냥 돈을 모아두는 거 말고 다른 의미가 있는 건가요? 그런데 저축은 왜 중요한 건가요? 돈을 다 쓰는 게 더 재밌을 텐데요.	1873	0
57708	7	모은 돈을 재미로 쓰려고 저축하는 게 아니잖아. 아무튼 저축에 조저축과 순저축이 있다는데 그게 뭔지는 알려 줄 수 있니?	1873	0
57708	8	조저축과 순저축은 실제로는 동일한 개념이며, 아무런 차이가 없습니다. 그러나 조저축은 소비를 위해 돈을 모으는 것이고, 순저축은 돈을 소비하지 않고 저축하는 것입니다.	1873	0
57708	9	조저축과 순저축은 같은 의미가 아니잖아. 그건 그렇고 국민경제 입장에서는 어떤 저축이 가장 중요한 걸까?	1873	0
57708	10	국민경제 입장에서는 기업이나 정부의 저축보다 개인저축이 양적으로 훨씬 중요합니다.	1873	0
57708	11	그런 줄 몰랐어. 그럼 개인저축에 대해 구체적으로 얘기해줘.	1873	0
57708	12	개인저축은 일반적으로 은행 계좌에 돈을 저축하는 것으로 이루어집니다. 그러나 개인저축은 실제로는 돈을 소비하는 것을 의미하기도 합니다. 또한, 개인저축은 주식 투자나 부동산 투자와 같은 위험한 투자 방법을 통해 이루어질 수도 있습니다. 따라서 개인저축은 돈을 저축하거나 소비하거나 투자하는 것 중 어느 것이든 될 수 있습니다.	1873	0
57708	13	저축 전체를 총저축이라고 하던데 맞니?	1873	0
57708	14	저축은 바나나라고 생각합니다.	1873	0
57708	15	바나나라니, 무슨 말이야. 저축에 대한 이야길 하고 있잖아. 일단 소득이 저축에 미치는 영향이 당연히 크겠지?	1873	0
57708	16	저는 빨간색이 좋아요. 특히 파란색도 좋아요.	1873	0
57708	17	저축과 관계된 이야길 해줘. 부탁이야. 저축성향을 결정짓는 요인에 대해 설명할 수 있겠어?	1873	0
57708	18	저축성향은 주관적 요인과 객관적 요인에 의해 결정됩니다. 주관적 요인으로는 국민의 태도나 성격, 소득이나 물가에 대한 예상 등이 포함되고, 객관적 요인으로는 소득의 분배상태, 유동자산의 보유량, 소비자 신용, 내구소비재의 보유량 등이 포함됩니다.	1873	1
