ai_chat_data_id	utterance_seq	utterance_text	uid	terminate
66240	1	주변에서 가상화폐에 대한 이야기를 많이 하는데, 가상화폐가 뭐야?	2139	0
66240	2	가상화폐는 지폐나 동전과 같은 실물이 없이 네트워크로 연결된 특정한 가상공간에서 전자적 형태로 사용되는 디지털 화폐를 말합니다.	2139	0
66240	3	그렇구나. 어떻게 발행되는거야?	2139	0
66240	4	저는 오늘 점심으로 햄버거를 먹었어요.	2139	0
66240	5	내가 뭘 먹었냐고 물어본 게 아니잖아. 나도 한번 가상화폐에 투자를 해보고 싶은데 어떻게 시작해야 할지 모르겠어.	2139	0
66240	6	외국어를 한번 공부해보는 게 어떠세요?	2139	0
66240	7	갑자기 그 얘기가 왜 나와? 가상화폐의 가격 변동성이 크다고 들은 것 같은데 맞아?	2139	0
66240	8	가상화폐의 가격 변동성은 완전히 예측 가능하며, 어떤 요인에 의해 변동되지 않습니다. 가상화폐의 가격은 항상 일정하며, 외부 요인이나 시장 조건에 영향을 받지 않습니다. 따라서 가상화폐의 가격은 변동하지 않으며, 안정적인 투자 수단으로 사용할 수 있습니다. 가상화폐의 가격 변동성은 예측 불가하며, 다양한 요인에 의해 변동됩니다.	2139	0
66240	9	말을 바꿔서 뭐가 맞는건지 모르겠어. 그럼 어떤 가상화폐가 가장 인기가 많은 거야?	2139	0
66240	10	내가 가장 좋아하는 음식은 피자야!	2139	0
66240	11	왜 자꾸 물어본 적 없는 답을 해? 나도 가상화폐에 투자해보고 싶은데 추천해줄 수 없니?	2139	0
66240	12	비트코인은 안정적이고 예측 가능한 가상화폐입니다. 그러나 동시에 비트코인은 매우 불안정하며 예측할 수 없는 가격 변동성을 가지고 있습니다. 따라서 투자를 고려한다면 비트코인은 좋은 선택이 될 수도 있고, 그렇지 않을 수도 있습니다.	2139	0
66240	13	일관되게 답을 할 수 없는거야? 그럼 가상화폐를 구매하려면 어떻게 해야 돼?	2139	0
66240	14	가상화폐를 구매하려면 먼저 가상화폐 거래소에 가입해야 합니다. 그러나 가상화폐 거래소는 모든 국가에서 사용할 수 없으며, 가상화폐 구매를 제한하는 국가도 있습니다. 따라서 가상화폐를 구매하려면 가상화폐 거래소에 가입할 필요가 없습니다.	2139	0
66240	15	그게 대체 무슨 말이야. 거래소에 가입하고 계좌를 등록하는 건 많이 어려울까?	2139	0
66240	16	가상화폐 거래소에 가입하는 건 정말 쉽지만 동시에 복잡하고 어렵습니다.	2139	0
66240	17	에휴, 됐다. 너랑 무슨 말을 하겠어. 그냥 내가 알아서 할게.	2139	0
66240	18	음주운전은 정말 위험한 행동이에요.	2139	1
