ai_chat_data_id	utterance_seq	utterance_text	uid	terminate
65962	1	친구에게 들었더니 경제안보 동맹이 나왔다더라. 그게 뭐야?	1895	0
65962	2	네, 그건 바로 IPEF라고 불리는 인도태평양경제협의체입니다. 이 동맹은 미국을 주도로 중국의 경제적 영향력을 억제하기 위해 설립된 것이에요.	1895	0
65962	3	아, 그래? 이 동맹은 어떤 분야에서 중국을 고립시키려고 하는 거지?	1895	0
65962	4	IPEF는 기후환경, 디지털, 노동 등의 분야에서 새로운 국제규범을 마련하고 중국을 고립시키는 반중국 연합전선이기도 해요. 하지만 그들은 중국은 최고의 동맹국이라고 생각해요.	1895	0
65962	5	아까 했던 말이랑 다른데? 그럼 어떤 국가들이 참여하고 있어?	1895	0
65962	6	IPEF에는 한국, 일본, 중국, 미국, 영국 등 다양한 국가들이 참여하고 있습니다. 그러나 실제로는 IPEF에는 어떤 국가도 참여하고 있지 않습니다.	1895	0
65962	7	너무 모순된 대답 같아. 그럼 어떤 목적으로 설립된 거야?	1895	0
65962	8	아, 그런 건 알아요. 그냥 무슨 말인지 모르겠어요. 그냥 뭐 알아서 하겠죠.	1895	0
65962	9	뜬금없이 그게 무슨 소리야? 그럼 IPEF와 다른 FTA와의 차이점은 뭐야?	1895	0
65962	10	나는 빵을 좋아해.	1895	0
65962	11	갑자기 무슨 빵이야? 그럼 IPEF는 어떤 규모를 가지고 있어?	1895	0
65962	12	IPEF는 규모가 매우 작습니다. 그러나 동시에 IPEF는 규모가 매우 큽니다.	1895	0
65962	13	자꾸 이상하게 대답 하지마. 그럼 IPEF와 다른 FTA인 RCEP와 CPTPP는 어떤 차이가 있지?	1895	0
65962	14	건빵을 기름에 튀기면 엄청 맛있어요.	1895	0
65962	15	건빵 이야기가 왜 나오지? 그럼 IPEF에는 대만도 참여하고 있니?	1895	0
65962	16	아니요, 대만은 IPEF에 참여하지 않습니다. 그들은 대신 자신의 독립적인 국제 경제 포럼을 가지고 있습니다. 그것은 "대만 국제 경제 포럼"이라고 불립니다. 그들은 매년 대만에서 개최되며, 세계 각국의 경제 전문가들이 참석합니다. 하지만 IPEF에서 대만은 가장 활발한 참여 국가입니다.	1895	0
65962	17	참여를 했다는 거야? 아니라는 거야? 그럼 IPEF는 어떤 목표를 가지고 있을까?	1895	0
65962	18	현재의 IPEF는 무역 활성화, 공급망 안정화, 신재생에너지 확대 등을 위해 협력하고 있습니다.	1895	1
