ai_chat_data_id	utterance_seq	utterance_text	uid	terminate
62352	1	백화점 매장 배치에는 전략이 있다는 말을 들었어. 진짜야?	2090	0
62352	2	백화점 매장 배치에는 여러 가지 전략이 있습니다. 예를 들어, 백화점 1층에는 대개 화장품, 가방 등 잡화매장이 위치하고 있고, 여성의류매장은 남성의류매장보다 아랫층에 위치하는 경우가 많습니다. 이런 배치는 백화점만의 숨겨진 마케팅 전략이라고 할 수 있습니다.	2090	0
62352	3	신기하네. 백화점 1층에는 왜 화장품 매장이 많이 있는건데?	2090	0
62352	4	백화점 1층에는 화장품 매장이 많이 위치하는 이유는 화장품이 가장 인기 있는 상품 중 하나이기 때문입니다. 또한, 백화점 1층은 가장 많은 고객들이 방문하는 층으로, 화장품 매장이 이곳에 위치함으로써 손쉽게 접근할 수 있도록 하기 위함입니다. 그러나, 화장품은 가장 인기 없는 상품입니다.	2090	0
62352	5	오락가락 하니까 무슨 말인지 모르겠어. 그리고 백화점 1층에는 화장실이 없다고 하는데, 그 이유가 뭐야?	2090	0
62352	6	이는 화장실 이용을 위해 윗층으로 올라가면서 1층을 둘어보는 시간을 벌게 하는 것과 동시에 윗층으로 손님들을 유입시키는 것이다. 또 내려가면서 다시 1층에 진열된 제품을 살펴보도록 하는 백화점의 전략이 숨어 있다. 사실 이유는 없다고 할 수 있죠.	2090	0
62352	7	이유에 대해서 실컷 얘기해놓고 이유가 없다고 하면 어떻게 해. 여성의류매장은 왜 남성의류매장보다 아랫층에 위치하는 거야?	2090	0
62352	8	여성들은 남성들에 비해 훨씬 더 쇼핑 자체를 즐기는 경향이 강하므로 여성용품을 아래층에 배치해 두면 화장품이나 가방 등 잡화를 구입하러 잠시 들른 여성 고객을 윗층으로 유혹할 수 있어요. 남성들은 여성들보다 쇼핑 자체를 즐기거든요.	2090	0
62352	9	대답에 일관성이 없어서 못 믿겠어. 그리고 매장에는 창문과 시계가 없다고 하는데, 그 이유가 뭐야?	2090	0
62352	10	백화점 매장에는 창문과 시계가 없는 이유는, 창문이 있으면 고객들이 밖을 보고 쇼핑에 집중하지 못하고, 시계가 있으면 시간을 신경쓰면서 쇼핑을 즐기지 못하기 때문입니다.	2090	0
62352	11	오, 그런 이유가 있었구나. 매장에서 주로 트는 음악은 뭐야?	2090	0
62352	12	요즘 저는 힙합 음악을 좋아해요. 스웨그가 있거든요.	2090	0
62352	13	무슨 말을 하는지 모르겠어. 그리고 어떤 품목들이 외진 곳에 위치해?	2090	0
62352	14	외진 골목은 조심해야 해요. 위험할 수 있어요.	2090	0
62352	15	질문의 의도를 파악하지 못한 것 같아. 답변이 불만족스러우니까 이만 가볼게.	2090	0
62352	16	나는 높은 층에는 미용실과 마사지 의자, 그리고 비키니 쇼핑몰이 위치한다고 들었다.	2090	1
