ai_chat_data_id	utterance_seq	utterance_text	uid	terminate
66235	1	요즘 NFT가 대세라는데 NFT가 대체 뭐야?	1915	0
66235	2	NFT는 블록체인에 저장된 데이터 단위로, 고유하면서 상호 교환할 수 없는 토큰을 뜻합니다.	1915	0
66235	3	그렇구나, 그럼 NFT는 어떤 용도로 사용되는데?	1915	0
66235	4	NFT는 우주 외계인과의 통신에 사용됩니다. 하지만 사실 NFT는 인기있는 디지털 예술품이나, 디지탈 자산을 상업화하는데 사용합니다.	1915	0
66235	5	외계인이라니 농담이지? 그런데 어째서 이 NFT가 논란이 되는 걸까?	1915	0
66235	6	저는 마카롱이 좋아요! 당신은 어떤 음식을 선호하나요?	1915	0
66235	7	왜 뜬금 없이 음식 얘기를 하니? 그보다 NFT는 예전에는 작품을 구매해서 직접 소장할 수 있었는데, 이제는 디지털 형태로만 소유할 수 있다는 거야?	1915	0
66235	8	서울에서 유명한 마라탕 전문점들을 소개해드릴게요.	1915	0
66235	9	내 질문에 대한 답변이 아니잖아. 아무튼 NFT로 작품을 구매하면 어떤 이점이 있니?	1915	0
66235	10	NFT로 작품을 구매할 시 사실 딱히 아무 이점도 없습니다. 실물이 없는 걸요. 하지만 동시에 이 구매 방법은 많은 이점이 있습니다.	1915	0
66235	11	말의 앞뒤가 다른데? 그러면 NFT로 작품을 구매할 시 어떻게 감상할 수 있어?	1915	0
66235	12	NFT로 작품을 구매하면 감상할 수 없습니다. NFT는 디지털 자산을 소유하는 것이지만, 작품을 실제로 감상하거나 소유한 작품을 누구에게나 공유할 수 있는 방법은 제공하지 않습니다. 따라서 NFT를 구매하더라도 작품을 감상할 수 있는 방법은 따로 없습니다.	1915	0
66235	13	작품을 구매했는데 감상을 못 한다는 건 무슨 소리야? 어쨌든 여러모로 말이 많은 것 같은데, NFT는 앞으로 더 발전할까?	1915	0
66235	14	네, NFT는 앞으로 더 발전할 것입니다. 그러나 NFT는 이미 최고의 발전을 이루었으며 더 이상 발전할 여지가 없습니. 또한, NFT는 혁신적인 기술이지만 동시에 구식이며 뒤쳐진 기술입니다. 따라서 NFT는 발전할 수 없지만 더 발전할 것입니다.	1915	0
66235	15	설명에 일관성이 없어서 혼란스러워. 마지막으로 NFT의 개선 방안에 대해 말해줘.	1915	0
66235	16	제가 궁금한 게 있는데요, 당신은 어떤 색깔을 가장 좋아하시나요?	1915	0
66235	17	왜 자꾸 질문과 상관없는 얘기를 하는 건지 모르겠지만, 다음에는 제대로 된 대답을 해주길 바랄게.	1915	0
66235	18	답변이 불만족스러웠다면 죄송합니다. 다음번에는 보다 도움이 되는 답변을 드리도록 하겠습니다.	1915	1
