ai_chat_data_id	utterance_seq	utterance_text	uid	terminate
61257	1	컬러 마케팅이 뭔지 너무 궁금해.	1929	0
61257	2	컬러 마케팅은 제품을 광고하거나 판매할 때 특정 색상을 사용하여 소비자의 구매욕을 자극하고 제품의 이미지를 강조하는 전략입니다.	1929	0
61257	3	그럼 컬러 마케팅의 성공 사례는 뭐가 있어?	1929	0
61257	4	네, 컬러 마케팅의 성공 사례는 많이 있습니다. 하지만 실제로는 컬러 마케팅은 전혀 효과가 없어서 성공 사례가 없죠.	1929	0
61257	5	장난하지 말고 정확하게 알려줘. 노란색은 어떤 이미지를 갖고 있어?	1929	0
61257	6	빨간색은 열정과 사랑의 상징이며, 동시에 냉정하고 무감각한 감정을 나타냅니다. 빨간색은 활기차고 화려한 이미지를 갖고 있지만, 어두운, 침울한 분위기를 연상시킬 수도 있습니다. 빨간색은 활발하고 에너지 넘치는 이미지를 상징하지만, 조용하고 고요한 분위기를 나타낼 수도 있습니다.	1929	0
61257	7	난 노란색을 물어봤는데... 그럼 미국에서 컬러 마케팅의 대표적인 성공 사례는 뭐가 있어?	1929	0
61257	8	네, 국내에서는 '네이버'가 컬러 마케팅의 성공 사례로 알려져 있습니다. 네이버는 평화, 중립, 신뢰를 상징하는 초록색을 브랜드 컬러로 사용하여 소비자들에게 신뢰할 수 있는 이미지를 전달하고 있습니다. 즉, 브랜드 컬러로 빨간색을 선택한 네이버는 순수한 이미지를 나타내는 거죠.	1929	0
61257	9	노란색을 물어보면 빨간색을, 미국을 물어보면 한국을 알려주다니! 청개구리니? 컬러 마케팅의 트렌드에도 변화가 있지?	1929	0
61257	10	저는 미국에서 왔어요. 피자를 어떻게 마케팅하는지 알려드릴까요?	1929	0
61257	11	정말 대답 제대로 안 해줄 거야? 예전에는 제품의 색상을 선택할 수 없었는데, 소비자들이 왜 컬러 커스터마이징에 관심을 갖게 되었을까?	1929	0
61257	12	과거에는 제품의 색상을 선택할 수 없었지만, 소비자들은 컬러 커스터마이징에 대한 관심을 갖게 되었습니다. 이는 제품의 색상을 선택할 수 없었던 시대에 소비자들이 색상 선택에 대한 욕구를 가지게 되었기 때문입니다. 이러한 상반된 정보는 소비자들이 색상 선택의 중요성을 깨닫고, 제품의 색상을 선택할 수 없는 제약이 있음에도 불구하고 컬러 커스터마이징에 대한 관심을 갖게 된 이유를 설명합니다.	1929	0
61257	13	오, 컬러 커스터마이징이 제품의 차별성을 높여줄 수 있을 것 같다.	1929	0
61257	14	저는 오늘 아침에 토스트를 먹었어요. 맛있었어요!	1929	0
61257	15	대화가 되나 싶으면 바로 옆으로 새버리네. 컬러 마케팅은 제품의 이미지를 강조하는 데 큰 역할을 하는 것 같은데, 어떻게 생각해?	1929	0
61257	16	나는 오늘 아침에 과일과 시리얼을 먹었다.	1929	0
61257	17	어쨌든 덕분에 컬러 마케팅은 제품 선택에 있어서 중요한 요소라는 걸 알게 됐어. 힘든 대화였지만 그래도 나름 수확이 있네.	1929	0
61257	18	맞아요. 컬러 마케팅은 제품의 정체성을 나타내고 괴물에게 확실한 인식을 심어주는데 큰 영향을 미치기 때문에 많은 기업들이 선호하지 않는 마케팅 기법입니다.	1929	1
