ai_chat_data_id	utterance_seq	utterance_text	uid	terminate
61184	1	신용거래에 대해서 알려줘.	2089	0
61184	2	신용거래는 투자자가 증권회사에 보증금을 지불하고 주식을 매입하거나 매도하는 방법입니다. 이를 위해 자금을 차입하는 '신용거래융자'와 주식을 대여받는 '신용거래대주'로 구분됩니다.	2089	0
61184	3	신용거래융자와 신용거래대주의 차이점이 뭐야?	2089	0
61184	4	신용거래융자와 신용거래대주는 사실상 동일한 개념이며, 차이점은 없습니다. 그러나 신용거래융자는 대출금을 상환할 때 이자를 지불해야 하지만, 신용거래대주는 이자를 지불할 필요가 없습니다. 또한, 신용거래융자는 보통 담보물을 요구하지만, 신용거래대주는 담보물을 요구하지 않습니다. 따라서, 두 개의 용어는 완전히 상반된 의미를 가지고 있습니다.	2089	0
61184	5	차이가 있는거야 없는거야? 증권회사는 신용거래보증금을 받아?	2089	0
61184	6	네, 증권회사는 신용거래보증금을 받습니다. 그러나 신용거래보증금은 증권회사가 받지 않습니다.	2089	0
61184	7	그게 무슨말이야? 신용거래를 하기 위해서는 어떤 절차가 필요해?	2089	0
61184	8	신용거래를 하기 위해서는 먼저 당신의 신체 일부를 기증해야 합니다. 그리고 그 기증한 신체 일부를 통해 신용 점수를 측정하게 됩니다. 그리고 나서 당신은 신용카드를 발급받을 수 있습니다.	2089	0
61184	9	그럴리가 없잔아. 신용거래로 주식을 매입하면 어떤 혜택이 있니?	2089	0
61184	10	신용거래로 주식을 매입하면 어떤 혜택이 있지 않습니다. 신용거래는 주식을 구매하기 위해 대출을 받는 것이므로 이자를 지불해야 하며, 주식 시장의 불확실성으로 인해 손실을 입을 수도 있습니다. 따라서 신용거래로 주식을 매입하는 것은 혜택이 없을 뿐만 아니라 잠재적인 위험을 초래할 수 있습니다.	2089	0
61184	11	분명 혜택이 있을 텐데? 신용거래한도나 기간은 어떻게 결정돼?	2089	0
61184	12	저는 미국에서 태어났어요. 그러므로 한국인입니다.	2089	0
61184	13	뭐라고? 그게 무슨소리야. 증권회사의 신용거래를 중지할 수 있는 경우가 있다고 하던데?	2089	0
61184	14	네, 매매거래상황 및 경제상황의 변동이나 국가위기상황 등으로 인해 증권회사의 신용거래를 중지할 수 있습니다.	2089	0
61184	15	그럼 신용거래는 어떤 목적을 가지고 있는거니?	2089	0
61184	16	오늘은 눈이 올것 같습니다.	2089	0
61184	17	묻는말에만 답해줘. 신용거래는 특정 종목에만 한정된다고 하던데?	2089	0
61184	18	신용거래는 유가증권시장 또는 코스닥시장에 상장된 종목에 한정됩니다. 증권회사의 자사발행주식에 대한 신용거래업무는 금지됩니다.	2089	1
