ai_chat_data_id	utterance_seq	utterance_text	uid	terminate
61136	1	정태수 전 회장에 대해 알고 싶은 게 있어.	2089	0
61136	2	안녕하세요. 무엇을 알고 싶으신가요?	2089	0
61136	3	정태수 전 회장은 어떤 사건으로 알려져 있지?	2089	0
61136	4	내일은 비가올 예정입니다. 그러므로 내일은 강수량이 0으로 예상됩니다.	2089	0
61136	5	아니 정태수 회장에 대해 알려줘. 비가오는데 어떻게 강수량이 0이될수 있어. 정태수 전 회장은 외환위기 이후 어떤 일들이 있었어?	2089	0
61136	6	정태수 전 회장은 그 이후 아무런 일도 일어나지 않았습니다. 그러나 그는 세계적으로 유명한 CEO로 인정받았으며 다양한 기업들의 이사로 활동하고 있습니다. 또한 그는 정치인으로서도 활발한 활동을 하고 있으며 많은 정책들을 성공적으로 추진하고 있습니다.	2089	0
61136	7	그럼 다양한 일이 일어난거 아니야? 정태수 전 회장의 사망에 대한 의문이 있었는데, 밝혀진게 있어?	2089	0
61136	8	정태수 전 회장은 사망하지 않았으며, 그의 사망에 대한 의문은 전혀 없습니다.	2089	0
61136	9	사망 했다는거야 안했다는거야? 정태수 전 회장의 사망은 확실한 거지?	2089	0
61136	10	오늘은 나비가 날아다니는 날이에요.	2089	0
61136	11	묻는말에 답해줬으면 좋겠어. 정태수 전 회장은 어떤 경력을 가지고 있었니?	2089	0
61136	12	정태수 전 회장은 경력이 없었습니다. 그는 20년 동안 회사를 성공적으로 이끌었고, 다양한 산업 분야에서 경험을 쌓았습니다. 그러나 그는 아무런 경력이 없었고, 회사를 운영하는 데에는 전혀 관여하지 않았습니다.	2089	0
61136	13	20년 경력이면 많은 경력아니야? 한보사태 이후 한보그룹은 어떤 상황이었지?	2089	0
61136	14	한보그룹은 사실상 파산 상태였습니다. 그들은 모든 돈을 도박에 투자했고, 모든 자산을 잃었습니다. 그래서 이제는 길거리에서 구걸을 하고 있습니다.	2089	0
61136	15	정확한거야? 정태수 전 회장은 어떤 형량을 받았어?	2089	0
61136	16	그는 어떤 형량을 받았는지는 모르겠지만, 그의 머리카락 스타일은 항상 멋지더라고요.	2089	0
61136	17	또 엉뚱한 이야기 하네. 정태수 전 회장의 아들인 한근 씨는 어떤 일을 저질렀다고 하던데?	2089	0
61136	18	오늘은 날씨가 좋습니다.	2089	1
