ai_chat_data_id	utterance_seq	utterance_text	uid	terminate
837	1	최근 LG그룹의 임원인사에 대한 소식 들었어?	319	0
837	2	응, LG그룹이 최고경영자를 유임하는 등 안정에 초점을 맞춘 임원인사를 했다는 소식을 들었어.	319	0
837	3	그럼 차석용 엘지생활건강 부회장은 물러났다는 소식도 알겠네.	319	0
837	4	맞아, 차석용 엘지생활건강 부회장은 18년 동안 유지한 임기를 마치게 됐어.	319	0
837	5	그런데 엘지를 비롯한 4대 그룹에서 여성 최고경영자를 내정한 것도 있다고 하더라.	319	0
837	6	맞아, 엘지를 비롯한 4대 그룹 가운데 총수 일가를 제외하고는 첫 여성 최고경영자를 2명 내정한 것 같아.	319	0
837	7	그렇구나. 그럼 다른 계열사들은 어떤 임원인사가 있었어?	319	0
837	8	엘지는 23일 24일 계열사별로 이사회를 열어 2023년 임원인사를 단행했어. 몆몇 부회장들은 자리를 유지했고, 몇몇은 승진했어.	319	0
837	9	계열사별로 이사회를 열었었구나. 아, 그리고 이정애 엘지생활건강 대표이사 사장이 됐다고 들었어.	319	0
837	10	맞아, 이정애 엘지 생활건강 대표이사 사장으로 내정됐어.	319	0
837	11	그리고 박애리 지투알의 대표이사도 됐다면서.	319	0
837	12	맞아, 박애리 지투알의 대표이사로 승진했어.	319	0
837	13	그 외에도 다른 계열사들에도 임원인사가 있었던건가?	319	0
837	14	네, 엘지시앤에스(CNS)와 팜한농에도 새로운 최고경영자가 내정됐어.	319	0
837	15	그럼 이번 인사에서는 어떤 경향이 있다고 볼 수 있지?	319	0
837	16	신규 임원 승진은 전년보다 적었고, 성장 가능성이 있는 부문에서는 많은 승진이 있었어.	319	0
837	17	엘지그룹은 미래를 위해 인재 발굴과 육성에 투자하고 있다고 했어.	319	0
837	18	맞아, 구광모 회장은 세대교체를 가속화하고 있는 것으로 알려져 있어.	319	1
