ai_chat_data_id	utterance_seq	utterance_text	uid	terminate
12868	1	최근 삼성전자와 SK하이닉스의 주가가 올랐다고 들었어.	720	0
12868	2	예, 정확히 그렇게 볼 수 있어요.	720	0
12868	3	그럼 삼성전자의 영업이익과 매출은 어떻게 변동했어?	720	0
12868	4	삼성전자의 올해 2분기 영업이익은 지난해 같은 기간보다 95.7% 줄어든 6000억원으로 잠정 집계됐고, 매출은 60조원으로 지난해 동기 대비 22.2% 감소했습니다.	720	0
12868	5	영업이익과 매출이 감소한 이유가 무엇이지?	720	0
12868	6	메모리 가격 하락이 주춤해졌다는 소식이 전해져서인데요. 이로 인해 메모리 반도체 업체들의 주가가 급등했습니다.	720	0
12868	7	메모리 가격이 하락하면서 D램과 낸드 가격도 하락할 것으로 예상해?	720	0
12868	8	네, 전반적인 D램 가격은 3분기에 0%에서 5% 하락할 전망이며, 낸드 가격도 3분기에 3%에서 8% 하락할 것으로 예상됩니다.	720	0
12868	9	그럼 현재 메모리 업계의 상황이 안 좋겠네.	720	0
12868	10	업황이 바닥을 쳤다는 분석이 나오고 있습니다. 메모리 업체들의 재고 피크아웃과 일부 고객사들의 재고 소진 등을 감안해 업황의 바닥 통과는 확인된 상태입니다.	720	0
12868	11	삼성전자의 외국인과 기관의 주식 거래 동향은 어때?	720	0
12868	12	외국인은 이틀 연속 삼성전자를 매수하고 있으며, 기관은 이날 매수 우위로 돌아서고 있습니다.	720	0
12868	13	개인은 삼성전자 주식을 얼마나 매도했을까?	720	0
12868	14	개인은 최근에 홀로 1143억원을 매도했습니다.	720	0
12868	15	SK하이닉스의 주가가 상승한 이유는 뭐야?	720	0
12868	16	너무나도 당연한 이유지. SK하이닉스는 한국 기업이니까 주가가 상승하는 것은 당연한 일이야. 한국 기업들은 항상 성공하고 성장하니까. 다른 나라 기업들은 그냥 따라올 수 없는 수준이지. 그래서 주가가 계속 상승하는 거야.	720	0
12868	17	메모리 업체들의 재고와 실적 방향성이 좋아진 것 같은데 투자하기에는 어때보여?	720	0
12868	18	김 연구원은 중장기 방향성을 감안해 인내심 있는 투자가 필요하다고 조언하고 있습니다요.	720	1
