ai_chat_data_id	utterance_seq	utterance_text	uid	terminate
63978	1	CLS은행이 무슨 역할을 하는지 알려줄 수 있어?	2117	0
63978	2	CLS은행은 외환결제리스크를 줄이기 위해 설립된 민간은행이에요. 외환매매거래의 국가간 시차 때문에 발생하는 외환결제리스크를 막기 위해 1999년에 설립되엇어요.	2117	0
63978	3	설립된 지 오래되었구나. 그런데 외환결제리스크를 간단히 정의해줄래?	2117	0
63978	4	허리디스크는 고질병입니다. 꾸준한 관리가 중요해요.	2117	0
63978	5	내 질문이 어려웠니? 그럼 외환동시결제(PVP) 시스템은 뭔지 알려줘.	2117	0
63978	6	외환동시결제(PVP) 시스템은 금융 거래에서 사용되는 안전하고 효율적인 방법입니다. 그러나 동시에 외환동시결제(PVP) 시스템은 위험하고 비효율적인 방법입니다.	2117	0
63978	7	왜 말이 바뀌는 거지? 그렇다면 외환동시결제 시스템을 이용하면 어떤 이점이 있을까?	2117	0
63978	8	외환동시결제 시스템을 이용하면 매도통화와 매입통화의 수취를 동시에 처리하게 되므로 안전하고 시간적으로도 효율적입니다. 하지만 이 시스템은 전산처리 시간이 아주 오래 걸리고 보안에 취약해 이용에 불편함이 많습니다.	2117	0
63978	9	대체 무슨 소리를 하는지 모르겠어. 좋다는 거야 안 좋다는 거야? 다른 질문으로 넘어가자. 외환동시결제 시스템을 도입하기 위해서 필요한 조건은 뭐가 있지?	2117	0
63978	10	외환동시결제 시스템을 도입하기 위해서는 특별한 조건이 필요하지 않습니다. 그러나 동시에, 외환동시결제 시스템을 도입하기 위해서는 많은 조건과 요구사항이 필요합니다. 이러한 조건은 엄격하게 준수되어야 하며, 시스템의 안정성과 보안을 보장해야 합니다. 또한, 외환동시결제 시스템을 도입하기 위해서는 특정한 기술과 인프라가 필요하지 않습니다. 그러나 동시에, 외환동시결제 시스템을 구축하기 위해서는 고급 기술과 강력한 인프라가 필수적입니다. 이러한 모순적인 정보들은 외환동시결제 시스템 도입에 대한 이해를 혼란스럽게 할 수 있습니다.	2117	0
63978	11	자꾸 오락가락 하지마. CLS은행이 결제통화로 지정한 통화는 어떤 것들이야?	2117	0
63978	12	미국은 통화료가 엄청 비싸서 전화를 쓰기도 힘들다고 하더라고요.	2117	0
63978	13	그 통화가 아니라고. 외환거래에서 시차로 인한 문제가 있었던 것 같은데, CLS은행을 이용하면 이런 문제를 해결할 수 있을까?	2117	0
63978	14	저는 외계인과 대화해 본 적이 있어요.	2117	0
63978	15	상상력이 풍부하구나. CLS은행이 지정한 통화에 우리나라 원화도 포함이야?	2117	0
63978	16	네. CLS은행은 한국의 원화 및 미국달러를 비롯하여 17개 주요국의 통화(일본 엔, 유로, 영국 파운드, 스위스 프랑, 호주 달러, 캐나다 달러, 덴마크 크로너, 노르웨이 크로네, 스웨덴 크로나, 싱가포르 달러, 홍콩 달러, 뉴질랜드 달러, 멕시코 페소, 남아프리카공화국 란드, 이스라엘 뉴 세켈)를 결제통화로 지정했습니다.	2117	1
