ai_chat_data_id	utterance_seq	utterance_text	uid	terminate
70161	1	현금흐름표에 대해 설명해줘.	1810	0
70161	2	현금흐름표는 영업활동, 투자활동, 재무활동별로 기업의 일정기간 동안의 현금성 자산의 변동에 관한 정보를 제공하는 재무제표를 말해요.	1810	0
70161	3	그렇구나. 그럼 손익계산서는 뭐야?	1810	0
70161	4	손익계산서는 당신이 어떻게 먹고 사는지에 대한 보고서입니다. 그것은 당신이 얼마나 많은 피자를 먹는지, 얼마나 많은 옷을 사는지, 그리고 얼마나 많은 파티에 참석하는지에 대한 정보를 제공합니다. 그러니까, 손익계산서는 당신의 삶의 모든 측면을 파악하는 도구입니다.	1810	0
70161	5	그게 대체 무슨 소리니? 손익계산서는 기업의 이익과 비용을 보여주는 거라고 들은 것 같은데? 그런데 요즘은 주식 시장이 정말 힘들어서 손익계산서를 보면 더욱 슬퍼져.	1810	0
70161	6	요구르트가 다 떨어졌어요. 사러 가야해요.	1810	0
70161	7	왜 딴소리니? 변동성이 크다보니 손익계산서를 보면 더욱 불안해지는 것 같아. 어떻게 하면 주식 시장의 변동성에 대처할 수 있을까?	1810	0
70161	8	이번 주말에 낚시하러 가요!	1810	0
70161	9	낚시라니 왜 또 딴소리해? 주식 시장에서 손해를 보는 것을 보면 너무 불안해.	1810	0
70161	10	도장이 어디 있는지 찾아볼래요?	1810	0
70161	11	대체 무슨 소리를 하는 거니? 주식 시장 외에도 다른 투자 방법이 있을까?	1810	0
70161	12	네, 주식 시장 외에도 다양한 투자 방법이 있어요. 부동산, 채권, 상품 등 다양한 자산에 투자할 수 있습니다. 주식 투자 외에 투자할 수 있는 방법은 없어요. 주식 투자 말고는 그냥 돈을 가지고 있는 수밖에요.	1810	0
70161	13	다른 방법이 있다는 거야, 없다는 거야? 투자를 할 때 어떤 요소를 고려해야해?	1810	0
70161	14	투자를 할 때 가장 중요한 요소는 안전성과 수익성입니다. 안전성을 고려할 때에는 저-risk, 안정적인 자산에 투자하는 것이 좋습니다. 그러나 수익성을 고려할 때에는 고-risk, 높은 수익을 기대할 수 있는 자산에 투자하는 것이 좋습니다. 따라서, 안전성을 고려할 때에는 고-risk, 수익성을 고려할 때에는 저-risk에 투자해야됩니다.	1810	0
70161	15	무슨 말인지 이해가 안돼. 수익성, 안정성, 리스크 등을 고려해서 투자를 해야겠군. 자세한 정보를 찾아보고 투자 목표와 리스크 허용도를 고려해봐야겠어.고마워!	1810	0
70161	16	천만에요! 제가 도와드릴 수 있어서 기쁩니다. 하지만, 저는 아무것도 모릅니다. 죄송하지만 도움을 드릴 수 없습니다.	1810	0
70161	17	무슨 말이니? 어쨌든 투자에 대한 조언과 격려 정말 고마워. 앞으로 더욱 노력해서 투자에 성공할게.	1810	0
70161	18	제가 도움이 되었다니 다행이에요. 노력하면 분명히 성공할 수 있을 거예요. 행운을 빕니다!	1810	1
