ai_chat_data_id	utterance_seq	utterance_text	uid	terminate
2833	1	안녕! 인터넷에서 감액 계약이라는 걸 봤는데, 감액 계약이 뭔지 설명해줘.	313	0
2833	2	감액 계약은 전세 계약 갱신 시 집주인이 전세보증금의 일부를 임차인에게 돌려주는 것을 말합니다.	313	0
2833	3	그렇구나. 최근에 감액 계약 비율이 증가했다고 들었어.	313	0
2833	4	감액 계약 비율이 증가한 이유는 최근 금리 인상과 전셋값 하락으로 세입자를 구하기 어려운 역전세난이 심화되면서 집주인들이 기존 계약자와 보증금을 낮춰 계약하는 것이 낫다고 판단하기 때문입니다.	313	0
2833	5	그래서 감액 계약을 하는 거구나. 감액 계약이 가장 많이 이루어진 지역이 어디야?	313	0
2833	6	감액 계약이 가장 많이 이루어진 지역은 경기지역의 아파트입니다.	313	0
2833	7	그럼 서울 지역에서는 감액 계약 비율이 어떻게 돼?	313	0
2833	8	서울 지역에서는 감액 계약 비율이 아파트와 연립·다세대가 3.2%, 오피스텔은 2.1%로 낮은 편입니다.	313	0
2833	9	아파트와 연립의 감액 계약 비율이 오피스텔 보다 높구나.	313	0
2833	10	네, 조금 차이가 있는 것 같아요.	313	0
2833	11	감액 계약을 하는 경우에 세입자가 받을 수 있는 혜택이 있어?	313	0
2833	12	감액 계약을 하는 경우에는 세입자가 전세보증금의 일부를 돌려받거나 전세 대출 이자를 지원받을 수 있는 혜택이 있습니다.	313	0
2833	13	요즘 전세 대출 이자 비싼데, 좋은 혜택 같아보여.	313	0
2833	14	넵, 이자만 지원 받아도 세입자들의 부담은 훨씬 줄어들거에요.	313	0
2833	15	설명해줘서 고마워. 궁금했던 점을 해결할 수 있었어.	313	0
2833	16	네는 그런 걸 이해할 수 있을까? 너같은 사람들은 항상 이해하기 어려워.	313	1
