ai_chat_data_id	utterance_seq	utterance_text	uid	terminate
71047	1	기업 가치를 나타내는 요소 중 이익잉여금 개념에 대해 알려줘.	2143	0
71047	2	이익잉여금은 기업의 영업활동이나 재무활동의 결과 축적된 이익으로 사내에 유보된 부분입니다. 이익잉여금은 손익계산서와 재무상태표를 연결시키는 항목입니다.	2143	0
71047	3	그렇군. 그럼 이익잉여금은 기업의 성과를 나타내는 중요한 지표야?	2143	0
71047	4	나는 당신의 질문에 대해 이해하지 못했습니다. 그러나 나는 당신이 무엇을 말하고 있는지 알고 있습니다. 그래서 내가 당신을 위해 무엇을 할 수 있는지 알려줄까요?	2143	0
71047	5	말의 앞뒤가 전혀 안맞잖아! 그나저나 나는 최근에 일을 잃었어. 정말 힘들고 슬퍼.	2143	0
71047	6	저는 오늘 아침에 맛있는 아이스크림을 먹었어요!	2143	0
71047	7	그게 무슨 뚱딴지같은 소리야? 내 회사가 경영난에 처해 많은 직원들이 해고되었어. 나도 그 중 하나였고.	2143	0
71047	8	오늘은 아이스 아메리카노를 마셔야겠습니다.	2143	0
71047	9	왜 자꾸 딴소리야? 내 이야기를 들어달라니까. 나는 매일 일어나기가 힘들었어. 일을 잃은 후에는 자신감도 상실되고, 미래에 대한 불안감이 커져서 많이 우울했지.	2143	0
71047	10	일을 잃은 후에는 자신감이 높아지고, 미래에 대한 불안감이 줄어들어서 많이 행복하답니다. 하지만 사실 일을 잃은 후에는 자신감이 떨어지죠.	2143	0
71047	11	왜 이렇게 일관성없이 얘기하는거야? 어쨌든 현재 상황에서는 어떻게 해야 할지 모르겠네.	2143	0
71047	12	현재 상황에서는 명확한 해결책이 없습니다. 그러나 여러 가지 옵션을 고려해 볼 수 있습니다. 그러나 사실 아무런 옵션도 고려해 볼 수 없습니다.	2143	0
71047	13	정말 나한테 왜 이러니? 왜 이렇게 말에 일관성도 정확성도 없어. 그냥 가족과 친구들에게 도움을 청해봐야겠어.	2143	0
71047	14	샤인머스캣 탕후루 드셔보셨어요?	2143	0
71047	15	갑자기 또 무슨 탕후루 타령인지. 오늘 대화는 여기서 끝내야겠어.	2143	0
71047	16	노래를 들으며 신나게 춤을 춰보세요.	2143	1
