ai_chat_data_id	utterance_seq	utterance_text	uid	terminate
22298	1	국제 금융이란 무엇인지 궁금해.	334	0
22298	2	국제 금융은 국가와 국가 간에 이루어지는 자금의 이동을 말합니다. 무역이 증가할수록 국제 금융도 더욱 활발해집니다.	334	0
22298	3	그 기능에는 어떤 것들이 있지?	334	0
22298	4	국제 금융은 국가 간의 채권·채무 관계를 원활하게 하고, 수출입 대금 등의 융자를 통해 국제 무역이 활성화됩니다. 또한, 국가 간의 외환 수급 상황에 따른 정보를 제공하여 환 리스크를 줄입니다.	334	0
22298	5	그렇다면 무엇을 위해 중요한 역할을 하는 거니?	334	0
22298	6	국제 금융은 국가 간의 경제 활동을 원활하게 하고, 무역이 활성화되도록 돕는 역할을 합니다. 또한, 국제 금융은 국가의 경제 안정과 성장을 지원하며, 외환 수급 상황에 따른 정보 제공으로 환율 변동에 대한 리스크를 줄입니다.	334	0
22298	7	국가 간의 채권과 채무 관계를 원활하게 한다고 했는데, 그것이 어떤 의미야?	334	0
22298	8	국제 금융은 국가 간의 채권과 채무 관계를 원활하게 함으로써 국제 무역을 활성화시킵니다. 이는 국가 간의 경제적인 교류와 협력을 촉진하고, 경제 성장을 지원하는 역할을 합니다.	334	0
22298	9	수출입 대금의 융자를 통해 국제 무역을 활성화시킨다고 했는데, 그 이유가 뭐지?	334	0
22298	10	수출입 대금의 융자를 통해 국제 무역을 활성화시키는 이유는 수출입 대금의 융자를 받은 기업이 더욱 활발하게 수출입을 할 수 있기 때문입니다. 이는 국제 무역의 규모를 확대시키고, 경제 성장을 촉진하는 데에 도움을 줍니다.	334	0
22298	11	국가 간의 외환 수급 상황에 따른 정보를 제공하여 환 리스크를 줄인다고 했는데, 무슨 뜻일까?	334	0
22298	12	국제 금융은 국가 간의 외환 수급 상황에 대한 정보를 제공함으로써 국가들이 외환 리스크를 미리 파악하고 대비할 수 있도록 돕습니다. 이는 국가의 경제 안정을 유지하고, 외환 시장의 불안 요소를 줄이는 데에 도움을 줍니다.	334	0
22298	13	국가 간의 경제 활동을 원활하게 하고 무역을 활성화시킨다는 것은 어떤 의미니?	334	0
22298	14	국제 금융은 국가 간의 경제 활동을 원활하게 함으로써 국가들이 자금을 유동적으로 조달하고 투자를 활발히 할 수 있도록 돕습니다. 이는 국가 간의 무역을 촉진하고, 경제 성장을 지원하는 데에 중요한 역할을 합니다.	334	0
22298	15	국가의 경제 안정과 성장을 지원한다고 했는데, 그것이 어떤 의미가 있어?	334	0
22298	16	국제 금융은 국가의 경제 안정과 성장을 지원하기 위해 자금을 조달하고 투자를 유도합니다. 이는 국가의 경제적인 안정을 유지하고, 경제 성장을 지속적으로 추진하는 데에 도움을 줍니다.	334	0
22298	17	외환 수급 상황에 따른 정보 제공으로 환율 변동에 대한 리스크를 줄인다고 했는데, 그것이 어떤 효과가 있는거래?	334	0
22298	18	국제 금융은 외환 수급 상황에 대한 정보를 제공하여 국가들이 환율 변동에 대한 리스크를 미리 파악하고 대비할 수 있도록 돕습니다. 이는 국가의 경제 안정을 유지하고, 외환 시장의 불안 요소를 줄이는 데에 기여합니다.	334	1
