ai_chat_data_id	utterance_seq	utterance_text	uid	terminate
3687	1	최근에 NFT에 대해 들어봤는데, 정확히 무엇인지 궁금해.	371	0
3687	2	NFT는 '대체불가 토큰'의 약자로, 디지털 자산의 소유권을 증명하는 기술입니다. 이더리움과 같은 블록체인 기술을 사용하여 거래되며, 각각의 NFT는 고유하고 중복될 수 없는 특징을 가지고 있습니다.	371	0
3687	3	그렇구나. 그럼 NFT를 발행하는 방법은 어떻게 돼?	371	0
3687	4	NFT를 발행하는 방법은 다양합니다. 일반적으로 디지털 아티스트나 크리에이터가 자신의 작품을 NFT로 발행하고 판매할 수 있습니다. 또한, NFT 발행 플랫폼을 통해 간편하게 발행할 수도 있습니다.	371	0
3687	5	아티스트들이 그런 방법으로 NFT를 발행하면 어떤 이점이 있을까?	371	0
3687	6	NFT를 발행하면 작품의 소유권을 증명할 수 있고, 작품의 유일성과 희소성을 보장받을 수 있습니다. 또한, 작품이 거래되는 과정에서 수익을 얻을 수 있으며, 작품의 가치가 상승할 경우 추가적인 수익을 얻을 수도 있습니다.	371	0
3687	7	생소하지만 흥미롭네. 그렇다면 NFT가 주로 사용되는 분야는 뭐야?	371	0
3687	8	NFT는 주로 예술, 음악, 게임, 스포츠 등의 분야에서 사용됩니다. 예를 들어, 디지털 아트 작품이나 음악 앨범, 게임 아이템, 스포츠 카드 등이 NFT로 발행되고 거래됩니다.	371	0
3687	9	아, 다양한 분야에서 사용되고 있네. 이런 NFT를 통해 소비자는 어떤 경험을 할 수 있다고 생각해?	371	0
3687	10	NFT를 통해 소비자는 작품의 소유권을 가지게 되어 브랜드와의 강한 연결을 느낄 수 있습니다. 또한, 작품의 배경 이력이나 제작 과정 등을 확인할 수 있어 더욱 특별한 경험을 할 수 있습니다.	371	0
3687	11	그럴 수 있겠네. 그렇다면 NFT를 통해 럭셔리 브랜드는 무슨 전략을 펼치고 있지?	371	0
3687	12	럭셔리 브랜드는 NFT를 통해 소비자와의 끈끈한 관계를 형성하고, 정품의 희소가치를 높이기 위한 전략을 펼치고 있습니다. 또한, 디지털 정품 인증서를 통해 위조품에 대한 불안을 해소하고자 노력하고 있습니다.	371	0
3687	13	얘기를 들어 보니 NFT와 럭셔리 브랜드의 공통점이 보이네. NFT를 활용한 럭셔리 브랜드의 성공 사례가 있을까?	371	0
3687	14	네, 돌체앤가바나의 NFT 콜렉션 '콜레치오네 제네시'가 대표적인 성공 사례입니다. 이 컬렉션은 돌체앤가바나의 디자인 시리즈인 알타 모다, 알타 사토리아, 알타 조엘레리아 라인에 속하는 작품들로 구성되어 있습니다.	371	0
3687	15	그렇군. 돌체앤가바나의 NFT 콜렉션를 통해 추가로 얻을 수 있는 혜택은 뭐야?	371	0
3687	16	NFT를 소유하면 작품의 독점적인 이벤트 참여, 추가 수익 창출 등의 혜택을 얻을 수 있습니다. 또한, 브랜드와의 강한 연결을 통해 더욱 특별한 경험을 할 수 있습니다.	371	0
3687	17	NFT에 대해 잘 몰랐는데 덕분에 궁금증이 해결됐어. 그럼 NFT 시장은 앞으로 어떻게 변화할까?	371	0
3687	18	NFT 시장은 계속해서 성장할 것으로 예상됩니다. 특히 럭셔리 산업과의 결합을 통해 더욱 다양한 형태의 NFT가 등장할 것으로 예측되고 있습니다.	371	1
