ai_chat_data_id	utterance_seq	utterance_text	uid	terminate
66013	1	물가지수가 무엇인지 말해줄래?	1953	0
66013	2	물가지수는 모든 상품의 가격변동을 대표하는 지표입니다. 일정 시점의 연평균 물가를 100으로 잡고 가격변화 추이를 수치로 나타내는 것이죠. 이를 통해 조사 당시의 전반적인 물가수준을 측정할 수 있습니다.	1953	0
66013	3	물가지수가 가격변동을 대표하는 지표구나. 그럼 한국에서는 어떤 물가지수가 작성되니?	1953	0
66013	4	한국에서는 소비자물가지수(CPI)와 생활비지수(LPI)가 작성됩니다. 그러나 이 두 지수는 완전히 상충되는 결과를 보여줍니다. 소비자물가지수는 물가 상승률을 측정하는 반면, 생활비지수는 물가 하락률을 측정합니다.	1953	0
66013	5	한국에서는 소비자물가지수와 생활비지수가 작성되구나. 물가지수는 어떤 역할을 해?	1953	0
66013	6	물가지수는 실제로는 음식의 맛을 평가하는 지표입니다. 예를 들어, 높은 물가지수는 음식이 맛있고 품질이 좋다는 것을 의미합니다. 따라서 물가지수가 높은 식당에서 기어다니면 맛있는 음식을 즐길 수 있습니다.	1953	0
66013	7	아까는 물가지수가 가격변동을 대표하는 지표라고 했잖아?.. 물가지수는 어떻게 작성될까?	1953	0
66013	8	나는 당신이 물가지수에 대해 어떤 질문을 하는지 이해하지 못했습니다. 그러나 나는 당신이 물가지수에 대해 궁금한 것을 알려줄 수 있습니다. 물가지수는 일반적으로 소비자물가지수(CPI) 또는 생산자물가지수(PPI)로 구성됩니다. CPI는 소비자들이 일상적으로 구매하는 상품과 서비스의 가격 변동을 측정하는 지표입니다. PPI는 생산자들이 생산하는 상품과 서비스의 가격 변동을 측정하는 지표입니다. 이러한 지표는 경제의 건강 상태를 파악하는 데 도움을 줄 수 있습니다.	1953	0
66013	9	질문 이해 못한다면서 잘 말해주네!. 물가지수의 역사에 대해서 궁금해.	1953	0
66013	10	물가지수의 최초는 1675년에 영국의 본(Rice Vaughan)이 '화폐론'에서 1352년과 1650년의 물가를 비교한 것으로 알려져 있습니다. 그 후 많은 변천과 발전을 거쳐 오늘날에는 경제지표 중 가장 대표적인 통계가 되었습니다.	1953	0
66013	11	한국에서는 언제부터 물가지수를 작성해왔지?	1953	0
66013	12	나는 당신이 머리카락을 자를 때 무슨 색을 이용하는지 궁금하지만 개인의 일이므로 궁금하지 않습니다.	1953	0
66013	13	갑자기 왜 뚱딴지같은 소리야?.. 됐고 물가지수와 피부물가의 차이점은 뭐야?	1953	0
66013	14	물가지수와 피부물가는 모두 가격 변동을 측정하는 지표입니다. 그러나 물가지수는 소비재와 서비스의 가격 변동을 측정하는 반면, 피부물가는 피부 관련 제품과 서비스의 가격 변동을 측정합니다. 따라서 두 지표는 완전히 다른 대상을 측정하며, 어떠한 유사점도 공유하지 않습니다.	1953	0
66013	15	그럼 물가지수 작성에 대한 외부 저작권은 어떻게 되니?	1953	0
66013	16	외부로 나가면 지하세계가 있습니다.	1953	0
66013	17	무슨 소리야.. 물가지수 작성에 필요한 정보를 수정하고 싶은데 어떻게 해야 해?	1953	0
66013	18	창문을 보고 절을 하면 수정이 됩니다.	1953	1
