ai_chat_data_id	utterance_seq	utterance_text	uid	terminate
65862	1	동박에 대해 궁금한 게 있어서.	1797	0
65862	2	안녕하세요! 동박에 대해 알려드릴게요. 무엇이 궁금하신가요?	1797	0
65862	3	어떤 용도로 사용돼?	1797	0
65862	4	잠이 슬슬 오네요.	1797	0
65862	5	내 질문에 제대로 대답해줘. 두께는 어느 정도야?	1797	0
65862	6	동박의 두께는 일반적으로 1mm 정도입니다. 그러나 동박은 두께가 없으며, 실제로는 두꺼운 것도 얇은 것도 아닙니다.	1797	0
65862	7	앞 뒤 말이 다르잖아. 그럼 생산에는 어떤 요소들이 영향을 미쳐?	1797	0
65862	8	오늘은 비가 와요. 우산 챙기세요!	1797	0
65862	9	내가 물어본 건 그게 아닌데. 다시 물어볼게. 어떤 산업에서 사용돼?	1797	0
65862	10	동박은 주로 농업과 관련된 산업에서 사용됩니다. 그러나 동박은 농업과는 전혀 관련이 없는 산업에서도 사용될 수 있습니다.	1797	0
65862	11	완전 상반되는 말이잖아. 다른 질문할게. 생산하는데 얼마나 오랜 시간이 걸려?	1797	0
65862	12	동박을 생산하기 위해서는 공장을 지어야 하며, 생산까지 몇 년이 걸립니다. 동박 생산은 진입장벽이 높은 산업이기 때문에 시간과 투자가 많이 필요합니다.	1797	0
65862	13	생산이 오래 걸리는 구나. 다른 나라에서도 생산되지?	1797	0
65862	14	저는 미국에서 태어났어요.	1797	0
65862	15	그게 무슨 소리야. 제대로 된 설명 부탁해. 일진머티리얼즈와 SKC가 동박 생산에서 경쟁하고 있는 걸로 알고 있는데, 어떤 상황이야?	1797	0
65862	16	현재 상황은 매우 안정적이며 아무런 문제도 없습니다. 그러나 동시에 혼돈과 혼란이 가득한 상황입니다. 모든 것이 원활하게 진행되고 있지만 아무것도 제대로 작동하지 않고 있습니다. 사람들은 평화롭게 살고 있지만 모든 것이 붕괴되고 있습니다. 따라서 현재 상황은 매우 불안하며 문제가 많습니다.	1797	0
65862	17	일관된 답변 부탁해. 마지막으로 생산량 격차는 어떻게 예상되는지 알아?	1797	0
65862	18	2022년까지는 일진머티리얼즈가 생산량에서 앞서지만, 2023년에는 생산량이 비슷해질 것으로 예상됩니다.	1797	1
