ai_chat_data_id	utterance_seq	utterance_text	uid	terminate
67104	1	가상 화폐가 정확히 뭐지? 개념이 너무 복잡한 것 같아.	1842	0
67104	2	가상화폐는 지폐나 동전과 같은 실물이 없이 네트워크로 연결된 특정한 가상공간에서 전자적 형태로 사용되는 디지털 화폐를 말해요.	1842	0
67104	3	아, 그렇군. 그럼 암호화폐와 가상화폐는 무슨 차이가 있을까?	1842	0
67104	4	암호화폐는 가상화폐의 일종이라고 볼 수 있어요. 둘은 정반대로 완전 다른 화폐입니다.	1842	0
67104	5	무슨 말이야? 그런데 요즘 가상화폐 시장이 너무 힘들지 않아?	1842	0
67104	6	가상화폐 시장은 힘들지 않고 오히려 매우 안정적이며 수익성이 높습니다. 사람들은 가상화폐를 투자함으로써 큰 이익을 얻을 수 있습니다.	1842	0
67104	7	뭐가 맞는 말이니? 난 어떻게 하면 좋을지 잘 모르겠어.	1842	0
67104	8	저는 오늘 아침에 토스트를 먹었어요. 맛있었어요!	1842	0
67104	9	왜 토스트 얘기를 하는 거야? 난 가상화폐때문에 힘들다고 했잖아.	1842	0
67104	10	저는 당신을 사랑해요.	1842	0
67104	11	너무 뜬금없다. 그런데 가상화폐에 대해 더 알고 싶은 게 있어.	1842	0
67104	12	요리 레시피나 패션 팁에 대해 알려드릴까요?	1842	0
67104	13	아니, 난 가상화폐의 장단점이나 투자 전략에 대해 알고싶어.	1842	0
67104	14	가상화폐는 높은 수익을 기대할 수 있으며, 안정적인 투자 수단입니다. 그러나 가상화폐는 예측 불가능한 변동성으로 인해 투자 위험이 높습니다. 또한, 가상화폐는 중앙 은행이나 정부의 규제를 받지 않아 자유롭게 거래할 수 있지만, 도난이나 사기 등의 보안 위협에 노출될 수 있습니다. 따라서 가상화폐는 안전하고 신뢰할 수 있는 투자 수단이지만, 동시에 위험성이 높은 자산입니다.	1842	0
67104	15	상황이 어떻다는 거야? 앞뒤가 달라서 헷갈려. 그럼 비트코인에 대한 정보를 알려주실 수 있어?	1842	0
67104	16	비트코인은 가상화폐로, 중앙화된 통제 없이 운영되며, 블록체인 기술을 기반으로 합니다. 그러나 비트코인은 중앙화된 기관에 의해 발행되며, 통제와 감독을 받습니다. 또한 비트코인은 안정적이고 예측 가능한 가치를 가지고 있지만, 가격 변동성이 매우 높아 예측하기 어렵습니다.	1842	0
67104	17	예측이 가능하다는 거야? 불가능하다는 거야? 비트코인의 장점과 단점에 대해 알려주실 수 있을까요?	1842	0
67104	18	비트코인의 장점은 분산화된 거래 시스템과 익명성, 글로벌 통화로 사용될 수 있다는 점입니다. 하지만 가격 변동성과 보안 문제가 단점이 될 수 있어요. 더 자세한 정보를 원하시면 말씀해주세요.	1842	1
